action,event_pk,rn,date,work_area,organization,survey,sampling_bout,site_id,project_specific_id,hakai_id,source,lat,long,gather_lat,gather_long,collection_method,line_out_depth,pressure_transducer_depth,filter_type,volume,installed,collected,preserved,analyzed,lab_technician,nh4_,no2_no3_um,no2_no3_ugl,no2_no3_units,tp,tdp,tn,tdn,srp,po4,sio2,po4pfilt,no3nfilt,po4punfl,no3nunfl,nh4nunfl,nh4__flag,no2_no3_flag,tp_flag,tdp_flag,tn_flag,tdn_flag,srp_flag,po4_flag,sio2_flag,po4pfilt_flag,no3nfilt_flag,po4punfl_flag,no3nunfl_flag,nh4nunfl_flag,analyzing_lab,row_flag,quality_level,comments,quality_log
,3665,1,4/23/2013,CALVERT,HAKAI,FGS,1,626 OUTLET,37,NUT4494,F,51.641718,-128.120582,,,,0,,0.45nm,13,,2013-04-23T17:47:19.000Z,2013-04-23T07:00:00.000Z,2013-11-25T08:00:00.000Z,,,,,,6.1,,268,225.3,,,,3.8,6,1.2,6,,NA,NA,AV,BDL,AV,AV,NA,NA,NA,SVD,AV,AV,AV,NA,NRAL,Results,Principal Investigator,,"1: Metadata has been QCd by BF2: QC flags and detection limits added by MK3: Results QC'ed by KS.4: We omitted 1015 and replicates due to time restraints"
,3666,1,4/23/2013,CALVERT,HAKAI,FGS,1,819 OUTLET,39,NUT4495,F,51.657375,-128.042222,,,,0,,0.45nm,13,,2013-04-23T18:40:06.000Z,2013-04-23T07:00:00.000Z,2013-11-25T08:00:00.000Z,,,,,,,2.1,203.5,199.4,,,,,6.2,1.2,6.5,,NA,NA,BDL,AV,AV,AV,NA,NA,NA,BDL,AV,AV,AV,NA,NRAL,Results,Principal Investigator,,"1: Metadata has been QCd by BF2: QC flags and detection limits added by MK3: Results QC'ed by KS.4: We omitted 1015 and replicates due to time restraints"
,3667,1,4/23/2013,CALVERT,HAKAI,FGS,1,844 OUTLET,35,NUT4496,F,51.658183,-128.002068,,,,0,,0.45nm,13,,2013-04-23T19:08:53.000Z,2013-04-23T07:00:00.000Z,2013-11-25T08:00:00.000Z,,,,,,,25.8,239.3,176.3,,,,1.7,5.7,,5.5,,NA,NA,BDL,SVC,AV,AV,NA,NA,NA,AV,AV,BDL,AV,NA,NRAL,Results,Principal Investigator,,"1: Metadata has been QCd by BF2: QC flags and detection limits added by MK3: Results QC'ed by KS.4: We omitted 1015 and replicates due to time restraints"
,3668,1,4/23/2013,CALVERT,HAKAI,FGS,1,693 OUTLET,38,NUT4497,F,51.647923,-127.996399,,,,0,,0.45nm,13,,2013-04-23T19:47:26.000Z,2013-04-23T07:00:00.000Z,2013-11-25T08:00:00.000Z,,,,,,,,123.2,113.6,,,,,7.4,,5.5,,NA,NA,BDL,BDL,AV,AV,NA,NA,NA,BDL,AV,BDL,AV,NA,NRAL,Results,Principal Investigator,,"1: Metadata has been QCd by BF2: QC flags and detection limits added by MK3: Results QC'ed by KS.4: We omitted 1015 and replicates due to time restraints"
,3669,1,4/23/2013,CALVERT,HAKAI,FGS,1,703 OUTLET,33,NUT4498,F,51.64853,-128.026062,,,,0,,0.45nm,13,,2013-04-23T20:29:19.000Z,2013-04-23T07:00:00.000Z,2013-11-25T08:00:00.000Z,,,,,,,17.2,81.5,81.8,,,,2.2,6.7,,5.7,,NA,NA,BDL,AV,AV,AV,NA,NA,NA,AV,SVD,BDL,AV,NA,NRAL,Results,Principal Investigator,,"1: Metadata has been QCd by BF2: QC flags and detection limits added by MK3: Results QC'ed by KS.4: We omitted 1015 and replicates due to time restraints"
,3670,1,4/23/2013,CALVERT,HAKAI,FGS,1,708 OUTLET,31,NUT4499,F,51.649199,-128.068516,,,,0,,0.45nm,13,,2013-04-23T21:10:23.000Z,2013-04-23T07:00:00.000Z,2013-11-25T08:00:00.000Z,,,,,,2.7,4,181.7,135.2,,,,1.6,6,1.1,,,NA,NA,AV,SVD,AV,AV,NA,NA,NA,SVD,AV,AV,BDL,NA,NRAL,Results,Principal Investigator,,"1: Metadata has been QCd by BF2: QC flags and detection limits added by MK3: Results QC'ed by KS.4: We omitted 1015 and replicates due to time restraints"
,3671,1,5/9/2013,CALVERT,HAKAI,FGS,1,819 OUTLET,8,NUT4500,F,51.657375,-128.042222,,,,0,,0.45nm,13,,2013-05-09T15:43:52.000Z,2013-05-09T07:00:00.000Z,2013-11-25T08:00:00.000Z,,31.5,,,,4.4,4.7,221.6,227.9,,,,13.2,6.2,5.3,6,,SVC,NA,AV,AV,AV,AV,NA,NA,NA,SVD,AV,SVD,AV,BDL,NRAL,Results,Principal Investigator,,"1: Metadata has been QCd by BF2: NA3: QC flags and detection limits added by MK. NH4 analyzed with 'UV' method. Later method is switched to 'Fluo' and results seem more stable and better detectable.4: Results QC'ed by KS."
,3672,1,5/9/2013,CALVERT,HAKAI,FGS,1,844 OUTLET,9,NUT4501,F,51.658183,-128.002068,,,,0,,0.45nm,13,,2013-05-09T16:25:07.000Z,2013-05-09T07:00:00.000Z,2013-11-25T08:00:00.000Z,,40.8,,,,6.9,11.2,264.4,226.9,,,,,6.5,,,61.8,SVC,NA,AV,SVD,AV,AV,NA,NA,NA,BDL,AV,BDL,BDL,SVC,NRAL,Results,Principal Investigator,,"1: Metadata has been QCd by BF2: NA3: QC flags and detection limits added by MK. NH4 analyzed with 'UV' method. Later method is switched to 'Fluo' and results seem more stable and better detectable.4: Results QC'ed by KS."
,3673,1,5/9/2013,CALVERT,HAKAI,FGS,1,693 OUTLET,34,NUT4502,F,51.647923,-127.996399,,,,0,,0.45nm,13,,2013-05-09T16:55:11.000Z,2013-05-09T07:00:00.000Z,2013-11-25T08:00:00.000Z,,,,,,7.6,7.7,158.2,186.7,,,,,10.1,1.2,6.5,40.8,BDL,NA,AV,AV,AV,SVD,NA,NA,NA,BDL,SVD,AV,AV,SVC,NRAL,Results,Principal Investigator,,"1: Metadata has been QCd by BF2: NA3: QC flags and detection limits added by MK. NH4 analyzed with 'UV' method. Later method is switched to 'Fluo' and results seem more stable and better detectable.4: Results QC'ed by KS."
,3674,1,5/9/2013,CALVERT,HAKAI,FGS,1,703 OUTLET,2,NUT4503,F,51.64853,-128.026062,,,,0,,0.45nm,13,,2013-05-09T17:28:40.000Z,2013-05-09T07:00:00.000Z,2013-11-25T08:00:00.000Z,,,,,,4,2.3,90.3,112.8,,,,2.6,9.4,,14.9,,BDL,NA,AV,AV,AV,SVD,NA,NA,NA,AV,AV,BDL,AV,BDL,NRAL,Results,Principal Investigator,,"1: Metadata has been QCd by BF2: NA3: QC flags and detection limits added by MK. NH4 analyzed with 'UV' method. Later method is switched to 'Fluo' and results seem more stable and better detectable.4: Results QC'ed by KS."
,3675,1,5/9/2013,CALVERT,HAKAI,FGS,1,708 OUTLET,6,NUT4504,F,51.649199,-128.068516,,,,0,,0.45nm,13,,2013-05-09T18:00:49.000Z,2013-05-09T07:00:00.000Z,2013-11-25T08:00:00.000Z,,28.7,,,,,3.2,180,188.3,,,,,,,,26.7,SVC,NA,BDL,AV,AV,AV,NA,NA,NA,BDL,BDL,BDL,BDL,SVC,NRAL,Results,Principal Investigator,,"1: Metadata has been QCd by BF2: NA3: QC flags and detection limits added by MK. NH4 analyzed with 'UV' method. Later method is switched to 'Fluo' and results seem more stable and better detectable.4: Results QC'ed by KS."
,3676,1,5/9/2013,CALVERT,HAKAI,FGS,1,626 OUTLET,3,NUT4505,F,51.641718,-128.120582,,,,0,,0.45nm,13,,2013-05-09T19:20:51.000Z,2013-05-09T07:00:00.000Z,2013-11-25T08:00:00.000Z,,71.8,,,,11.2,7.9,324.2,315.9,,,,7.8,,3,,42,SVC,NA,AV,AV,AV,AV,NA,NA,NA,SVD,BDL,AV,BDL,SVC,NRAL,Results,Principal Investigator,,"1: Metadata has been QCd by BF2: NA3: QC flags and detection limits added by MK. NH4 analyzed with 'UV' method. Later method is switched to 'Fluo' and results seem more stable and better detectable.4: Results QC'ed by KS."
,3676,2,5/9/2013,CALVERT,HAKAI,FGS,1,626 OUTLET,5,NUT4506,F,51.641718,-128.120582,,,,0,,0.45nm,13,,2013-05-09T19:20:51.000Z,2013-05-09T07:00:00.000Z,2013-11-25T08:00:00.000Z,,,,,,7.8,5.7,315.9,309.5,,,,,,1.1,,,BDL,NA,AV,AV,AV,AV,NA,NA,NA,BDL,BDL,AV,BDL,BDL,NRAL,Results,Principal Investigator,,"1: Metadata has been QCd by BF2: NA3: QC flags and detection limits added by MK. NH4 analyzed with 'UV' method. Later method is switched to 'Fluo' and results seem more stable and better detectable.4: Results QC'ed by KS."
,3678,1,5/17/2013,CALVERT,HAKAI,FGS,1,626 OUTLET,19,NUT4507,F,51.641718,-128.120582,,,,0,,0.45nm,13,,2013-05-17T15:58:13.000Z,2013-05-17T07:00:00.000Z,2013-11-25T08:00:00.000Z,,43.4,,,,10.3,8.2,267.1,311.9,,,,,,,,22.8,SVC,NA,AV,AV,AV,SVD,NA,NA,NA,BDL,BDL,BDL,BDL,SVC,NRAL,Results,Principal Investigator,,"1: Metadata has been QCd by BF2: QC flags and detection limits added by MK. NH4 analyzed with 'UV' method. Later method is switched to 'Fluo' and results seem more stable and better detectable.3: Results QC'ed by KS.4: Three YSI readings were taken at each stream 1. in a bucket of stream water; 2. in the stream; 3. back in the bucket"
,3679,1,5/17/2013,CALVERT,HAKAI,FGS,1,708 OUTLET,36,NUT4508,F,51.649199,-128.068516,,,,0,,0.45nm,13,,2013-05-17T16:56:09.000Z,2013-05-17T07:00:00.000Z,2013-11-25T08:00:00.000Z,,34.8,,,,5.5,23.8,150,195.3,,,,,,,,,SVC,NA,AV,SVD,AV,SVD,NA,NA,NA,BDL,BDL,BDL,BDL,BDL,NRAL,Results,Principal Investigator,,"1: Metadata has been QCd by BF2: QC flags and detection limits added by MK. NH4 analyzed with 'UV' method. Later method is switched to 'Fluo' and results seem more stable and better detectable.3: Results QC'ed by KS.4: Three YSI readings were taken at each stream 1. in a bucket of stream water; 2. in the stream; 3. back in the bucket"
,3680,1,5/17/2013,CALVERT,HAKAI,FGS,1,703 OUTLET,16,NUT4509,F,51.64853,-128.026062,,,,0,,0.45nm,13,,2013-05-17T17:19:43.000Z,2013-05-17T07:00:00.000Z,2013-11-25T08:00:00.000Z,,42.6,,,,15.1,,92.6,141.1,,,,,,1.9,,,SVC,NA,AV,BDL,AV,SVD,NA,NA,NA,BDL,BDL,AV,BDL,BDL,NRAL,Results,Principal Investigator,,"1: Metadata has been QCd by BF2: QC flags and detection limits added by MK. NH4 analyzed with 'UV' method. Later method is switched to 'Fluo' and results seem more stable and better detectable.3: Results QC'ed by KS.4: Three YSI readings were taken at each stream 1. in a bucket of stream water; 2. in the stream; 3. back in the bucket"
,3681,1,5/17/2013,CALVERT,HAKAI,FGS,1,693 OUTLET,14,NUT4510,F,51.647923,-127.996399,,,,0,,0.45nm,13,,2013-05-17T18:11:28.000Z,2013-05-17T07:00:00.000Z,2013-11-25T08:00:00.000Z,,42.1,,,,7.3,16.1,131,174.5,,,,,,,,33.5,SVC,NA,AV,SVD,AV,SVD,NA,NA,NA,BDL,BDL,BDL,BDL,SVC,NRAL,Results,Principal Investigator,,"1: Metadata has been QCd by BF2: QC flags and detection limits added by MK. NH4 analyzed with 'UV' method. Later method is switched to 'Fluo' and results seem more stable and better detectable.3: Results QC'ed by KS.4: Three YSI readings were taken at each stream 1. in a bucket of stream water; 2. in the stream; 3. back in the bucket"
,3682,1,5/17/2013,CALVERT,HAKAI,FGS,1,844 OUTLET,13,NUT4511,F,51.658183,-128.002068,,,,0,,0.45nm,13,,2013-05-17T18:26:55.000Z,2013-05-17T07:00:00.000Z,2013-11-25T08:00:00.000Z,,40.7,,,,3.5,9.7,231,256,,,,1.4,5.5,,,,SVC,NA,AV,SVD,AV,AV,NA,NA,NA,AV,AV,BDL,BDL,BDL,NRAL,Results,Principal Investigator,,"1: Metadata has been QCd by BF2: QC flags and detection limits added by MK. NH4 analyzed with 'UV' method. Later method is switched to 'Fluo' and results seem more stable and better detectable.3: Results QC'ed by KS.4: Three YSI readings were taken at each stream 1. in a bucket of stream water; 2. in the stream; 3. back in the bucket"
,3683,1,5/17/2013,CALVERT,HAKAI,FGS,1,819 OUTLET,32,NUT4512,F,51.657375,-128.042222,,,,0,,0.45nm,13,,2013-05-17T19:03:36.000Z,2013-05-17T07:00:00.000Z,2013-11-25T08:00:00.000Z,,47.4,,,,8.8,2277.7,237.5,314.5,,,,,5.1,1.1,,,SVC,NA,AV,SVD,AV,SVD,NA,NA,NA,BDL,AV,AV,BDL,BDL,NRAL,Results,Principal Investigator,,"1: Metadata has been QCd by BF2: QC flags and detection limits added by MK. NH4 analyzed with 'UV' method. Later method is switched to 'Fluo' and results seem more stable and better detectable.3: Results QC'ed by KS.4: Three YSI readings were taken at each stream 1. in a bucket of stream water; 2. in the stream; 3. back in the bucket5: Three YSI readings were taken at each stream 1. in a bucket of stream water; 2. in the stream; 3. back in the bucket."
,3684,1,5/17/2013,CALVERT,HAKAI,FGS,1,1015 OUTLET,10,NUT4513,F,51.690527,-128.067788,,,,0,,0.45nm,13,,2013-05-17T19:40:08.000Z,2013-05-17T07:00:00.000Z,2013-11-25T08:00:00.000Z,,,,,,47.8,19.3,199.8,204.7,,,,,,,,,BDL,NA,SVC,AV,AV,AV,NA,NA,NA,BDL,BDL,BDL,BDL,BDL,NRAL,Results,Principal Investigator,,"1: Metadata has been QCd by BF2: QC flags and detection limits added by MK. NH4 analyzed with 'UV' method. Later method is switched to 'Fluo' and results seem more stable and better detectable.3: Results QC'ed by KS.4: Three YSI readings were taken at each stream 1. in a bucket of stream water; 2. in the stream; 3. back in the bucket"
,3685,1,5/28/2013,CALVERT,HAKAI,FGS,1,626 OUTLET,26,NUT4514,F,51.641718,-128.120582,,,,0,,0.45nm,13,,2013-05-28T15:52:44.000Z,2013-05-28T07:00:00.000Z,2013-11-25T08:00:00.000Z,,,,,,9.1,2.5,328.9,579.2,,,,,,1.9,,,BDL,NA,AV,AV,AV,SVD,NA,NA,NA,BDL,BDL,AV,BDL,BDL,NRAL,Results,Principal Investigator,,"1: Metadata has been QCd by BF2: NA3: QC flags and detection limits added by MK. NH4 analyzed with 'UV' method. Later method is switched to 'Fluo' and results seem more stable and better detectable.4: Results QC'ed by KS."
,3686,1,5/28/2013,CALVERT,HAKAI,FGS,1,708 OUTLET,28,NUT4515,F,51.649199,-128.068516,,,,0,,0.45nm,13,,2013-05-28T16:30:41.000Z,2013-05-28T07:00:00.000Z,2013-11-25T08:00:00.000Z,,,,,,7.5,,232,230.2,,,,,,,,,BDL,NA,AV,BDL,AV,AV,NA,NA,NA,BDL,BDL,BDL,BDL,BDL,NRAL,Results,Principal Investigator,,"1: Metadata has been QCd by BF2: NA3: QC flags and detection limits added by MK. NH4 analyzed with 'UV' method. Later method is switched to 'Fluo' and results seem more stable and better detectable.4: Results QC'ed by KS."
,3687,1,5/28/2013,CALVERT,HAKAI,FGS,1,703 OUTLET,11,NUT4516,F,51.64853,-128.026062,,,,0,,0.45nm,13,,2013-05-28T17:05:02.000Z,2013-05-28T07:00:00.000Z,2013-11-25T08:00:00.000Z,,46.6,,,,15.4,3065.8,166.8,201.2,,,,2.1,15,,20.7,,SVC,NA,AV,SVD,AV,SVD,NA,NA,NA,AV,AV,BDL,AV,BDL,NRAL,Results,Principal Investigator,,"1: Metadata has been QCd by BF2: NA3: QC flags and detection limits added by MK. NH4 analyzed with 'UV' method. Later method is switched to 'Fluo' and results seem more stable and better detectable.4: Results QC'ed by KS."
,3688,1,5/28/2013,CALVERT,HAKAI,FGS,1,693 OUTLET,7,NUT4517,F,51.647923,-127.996399,,,,0,,0.45nm,13,,2013-05-28T17:33:58.000Z,2013-05-28T07:00:00.000Z,2013-11-25T08:00:00.000Z,,42,,,,5.5,6.1,222.1,199,,,,,,,,,SVC,NA,AV,AV,AV,AV,NA,NA,NA,BDL,BDL,BDL,BDL,BDL,NRAL,Results,Principal Investigator,,"1: Metadata has been QCd by BF2: NA3: QC flags and detection limits added by MK. NH4 analyzed with 'UV' method. Later method is switched to 'Fluo' and results seem more stable and better detectable.4: Results QC'ed by KS."
,3689,1,5/28/2013,CALVERT,HAKAI,FGS,1,844 OUTLET,24,NUT4518,F,51.658183,-128.002068,,,,0,,0.45nm,13,,2013-05-28T17:58:25.000Z,2013-05-28T07:00:00.000Z,2013-11-25T08:00:00.000Z,,,,,,6.5,8.5,274.1,253.6,,,,,,,5.4,,BDL,NA,AV,SVD,AV,AV,NA,NA,NA,BDL,BDL,BDL,AV,BDL,NRAL,Results,Principal Investigator,,"1: Metadata has been QCd by BF2: NA3: QC flags and detection limits added by MK. NH4 analyzed with 'UV' method. Later method is switched to 'Fluo' and results seem more stable and better detectable.4: Results QC'ed by KS."
,3690,1,5/28/2013,CALVERT,HAKAI,FGS,1,819 OUTLET,29,NUT4519,F,51.657375,-128.042222,,,,0,,0.45nm,13,,2013-05-28T18:26:46.000Z,2013-05-28T07:00:00.000Z,2013-11-25T08:00:00.000Z,,,,,,7.2,,272.8,257.6,,,,,,2.6,,,BDL,NA,AV,BDL,AV,AV,NA,NA,NA,BDL,BDL,AV,BDL,BDL,NRAL,Results,Principal Investigator,,"1: Metadata has been QCd by BF2: NA3: QC flags and detection limits added by MK. NH4 analyzed with 'UV' method. Later method is switched to 'Fluo' and results seem more stable and better detectable.4: Results QC'ed by KS."
,3691,1,5/28/2013,CALVERT,HAKAI,FGS,1,1015 OUTLET,17,NUT4520,F,51.690527,-128.067788,,,,0,,0.45nm,13,,2013-05-28T20:29:50.000Z,2013-05-28T07:00:00.000Z,2013-11-25T08:00:00.000Z,,,,,,91.4,21.5,265.6,270.2,,,,,,,5.6,,BDL,NA,SVD,SVC,AV,AV,NA,NA,NA,BDL,BDL,BDL,AV,BDL,NRAL,Results,Principal Investigator,,"1: Metadata has been QCd by BF2: NA3: QC flags and detection limits added by MK. NH4 analyzed with 'UV' method. Later method is switched to 'Fluo' and results seem more stable and better detectable.4: Results QC'ed by KS."
,3691,3,5/28/2013,CALVERT,HAKAI,FGS,1,1015 OUTLET,22,NUT4521,F,51.690527,-128.067788,,,,0,,0.45nm,13,,2013-05-28T20:47:07.000Z,2013-05-28T07:00:00.000Z,2013-11-25T08:00:00.000Z,,,,,,14.7,10.1,559.3,236.3,,,,,,,5.2,,BDL,NA,AV,AV,AV,AV,NA,NA,NA,BDL,BDL,BDL,AV,BDL,NRAL,Results,Principal Investigator,,"1: Metadata has been QCd by BF2: NA3: QC flags and detection limits added by MK. NH4 analyzed with 'UV' method. Later method is switched to 'Fluo' and results seem more stable and better detectable.4: Results QC'ed by KS."
,3691,4,5/28/2013,CALVERT,HAKAI,FGS,1,1015 OUTLET,25,NUT4522,F,51.690527,-128.067788,,,,0,,0.45nm,13,,2013-05-28T21:02:45.000Z,2013-05-28T07:00:00.000Z,2013-11-25T08:00:00.000Z,,26.7,,,,5.6,12.7,239.7,246.4,,,,,,12.6,6.7,,SVC,NA,AV,SVD,AV,AV,NA,NA,NA,BDL,BDL,SVD,AV,BDL,NRAL,Results,Principal Investigator,,"1: Metadata has been QCd by BF2: NA3: QC flags and detection limits added by MK. NH4 analyzed with 'UV' method. Later method is switched to 'Fluo' and results seem more stable and better detectable.4: Results QC'ed by KS."
,3691,2,5/28/2013,CALVERT,HAKAI,FGS,1,1015 OUTLET,20,NUT4523,F,51.690527,-128.067788,,,,0,,0.45nm,13,,2013-05-28T21:18:51.000Z,2013-05-28T07:00:00.000Z,2013-11-25T08:00:00.000Z,,,,,,40.7,36,281.3,233.1,,,,,,,,,BDL,NA,SVC,SVC,AV,AV,NA,NA,NA,BDL,BDL,BDL,BDL,BDL,NRAL,Results,Principal Investigator,,"1: Metadata has been QCd by BF2: NA3: QC flags and detection limits added by MK. NH4 analyzed with 'UV' method. Later method is switched to 'Fluo' and results seem more stable and better detectable.4: Results QC'ed by KS."
,3695,1,6/11/2013,CALVERT,HAKAI,FGS,1,626 OUTLET,79,NUT4524,F,51.641718,-128.120582,,,,0,,0.45nm,13,,2013-06-11T13:38:28.000Z,2013-06-11T07:00:00.000Z,2013-11-25T08:00:00.000Z,,35.8,,,,11.8,69,416.5,388.8,,,,2.1,,1.4,,,SVC,NA,AV,SVD,AV,AV,NA,NA,NA,SVD,BDL,AV,BDL,BDL,NRAL,Results,Principal Investigator,,"1: Metadata has been QCd by BF2: NA3: QC flags and detection limits added by MK. NH4 analyzed with 'UV' method. Later method is switched to 'Fluo' and results seem more stable and better detectable.4: Results QC'ed by KS."
,3696,1,6/11/2013,CALVERT,HAKAI,FGS,1,708 OUTLET,76,NUT4525,F,51.649199,-128.068516,,,,0,,0.45nm,13,,2013-06-11T14:27:43.000Z,2013-06-11T07:00:00.000Z,2013-11-25T08:00:00.000Z,,27.9,,,,5.4,8.2,222.8,203.1,,,,,,,,,SVC,NA,AV,SVD,AV,AV,NA,NA,NA,BDL,BDL,BDL,BDL,BDL,NRAL,Results,Principal Investigator,,"1: Metadata has been QCd by BF2: NA3: QC flags and detection limits added by MK. NH4 analyzed with 'UV' method. Later method is switched to 'Fluo' and results seem more stable and better detectable.4: Results QC'ed by KS."
,3697,1,6/11/2013,CALVERT,HAKAI,FGS,1,703 OUTLET,74,NUT4526,F,51.64853,-128.026062,,,,0,,0.45nm,13,,2013-06-11T15:02:54.000Z,2013-06-11T07:00:00.000Z,2013-11-25T08:00:00.000Z,,,,,,6.1,204.5,181.5,170.9,,,,2.1,,,,,BDL,NA,AV,SVD,AV,AV,NA,NA,NA,AV,BDL,BDL,BDL,BDL,NRAL,Results,Principal Investigator,,"1: Metadata has been QCd by BF2: NA3: QC flags and detection limits added by MK. NH4 analyzed with 'UV' method. Later method is switched to 'Fluo' and results seem more stable and better detectable.4: Results QC'ed by KS."
,3698,1,6/11/2013,CALVERT,HAKAI,FGS,1,693 OUTLET,71,NUT4527,F,51.647923,-127.996399,,,,0,,0.45nm,13,,2013-06-11T15:31:13.000Z,2013-06-11T07:00:00.000Z,2013-11-25T08:00:00.000Z,,21.4,,,,11.3,1181.3,219.1,261.6,,,,3.6,,3.3,,,SVC,NA,AV,SVD,AV,SVD,NA,NA,NA,AV,BDL,AV,BDL,BDL,NRAL,Results,Principal Investigator,,"1: Metadata has been QCd by BF2: NA3: QC flags and detection limits added by MK. NH4 analyzed with 'UV' method. Later method is switched to 'Fluo' and results seem more stable and better detectable.4: Results QC'ed by KS."
,3699,1,6/11/2013,CALVERT,HAKAI,FGS,1,844 OUTLET,73,NUT4528,F,51.658183,-128.002068,,,,0,,0.45nm,13,,2013-06-11T15:59:11.000Z,2013-06-11T07:00:00.000Z,2013-11-25T08:00:00.000Z,,35.7,,,,5.5,45.2,316.9,313.2,,,,,,,5.5,,SVC,NA,AV,SVD,AV,AV,NA,NA,NA,BDL,BDL,BDL,AV,BDL,NRAL,Results,Principal Investigator,,"1: Metadata has been QCd by BF2: NA3: QC flags and detection limits added by MK. NH4 analyzed with 'UV' method. Later method is switched to 'Fluo' and results seem more stable and better detectable.4: Results QC'ed by KS."
,3700,1,6/11/2013,CALVERT,HAKAI,FGS,1,819 OUTLET,72,NUT4529,F,51.657375,-128.042222,,,,0,,0.45nm,13,,2013-06-11T16:28:02.000Z,2013-06-11T07:00:00.000Z,2013-11-25T08:00:00.000Z,,,,,,6.4,51.5,340.2,305,,,,,,,5.6,21.5,BDL,NA,AV,SVD,AV,AV,NA,NA,NA,BDL,BDL,BDL,AV,SVC,NRAL,Results,Principal Investigator,,"1: Metadata has been QCd by BF2: NA3: QC flags and detection limits added by MK. NH4 analyzed with 'UV' method. Later method is switched to 'Fluo' and results seem more stable and better detectable.4: Results QC'ed by KS."
,3700,2,6/11/2013,CALVERT,HAKAI,FGS,1,819 OUTLET,77,NUT4530,F,51.657375,-128.042222,,,,0,,0.45nm,13,,2013-06-11T16:28:02.000Z,2013-06-11T07:00:00.000Z,2013-11-25T08:00:00.000Z,,26.5,,,,7.1,29.2,327,312.3,,,,3.3,7.5,,,,SVC,NA,AV,SVD,AV,AV,NA,NA,NA,AV,AV,BDL,BDL,BDL,NRAL,Results,Principal Investigator,,"1: Metadata has been QCd by BF2: NA3: QC flags and detection limits added by MK. NH4 analyzed with 'UV' method. Later method is switched to 'Fluo' and results seem more stable and better detectable.4: Results QC'ed by KS."
,3702,1,6/11/2013,CALVERT,HAKAI,FGS,1,1015 OUTLET,75,NUT4531,F,51.690527,-128.067788,,,,0,,0.45nm,13,,2013-06-11T17:21:33.000Z,2015-08-06T03:11:30.000Z,2013-11-25T08:00:00.000Z,Lucy,,,,,4.8,173.4,232,220.3,,,,,,,,,BDL,NA,AV,SVD,AV,AV,NA,NA,NA,BDL,BDL,BDL,BDL,BDL,NRAL,Results,Principal Investigator,,"1: Metadata has been QCd by BF2: NA3: QC flags and detection limits added by MK. NH4 analyzed with 'UV' method. Later method is switched to 'Fluo' and results seem more stable and better detectable.4: Results QC'ed by KS."
,3702,2,6/11/2013,CALVERT,HAKAI,FGS,1,1015 OUTLET,80,NUT4532,F,51.690527,-128.067788,,,,0,,0.45nm,13,,2013-06-11T17:21:33.000Z,2013-06-11T07:00:00.000Z,2013-11-25T08:00:00.000Z,,,,,,6.1,58.6,240.5,228.7,,,,1.3,,1.4,,,BDL,NA,AV,SVD,AV,AV,NA,NA,NA,AV,BDL,AV,BDL,BDL,NRAL,Results,Principal Investigator,,"1: Metadata has been QCd by BF2: NA3: QC flags and detection limits added by MK. NH4 analyzed with 'UV' method. Later method is switched to 'Fluo' and results seem more stable and better detectable.4: Results QC'ed by KS."
,3704,1,6/25/2013,CALVERT,HAKAI,FGS,1,626 OUTLET,62,NUT4533,F,51.641718,-128.120582,,,,0,,0.45nm,13,,2013-06-25T13:49:25.000Z,2013-06-25T07:00:00.000Z,2013-11-25T08:00:00.000Z,,21.2,,,,11,32.5,467.6,435.1,,,,1.7,5.6,2.2,,20.7,SVC,NA,AV,SVD,AV,AV,NA,NA,NA,AV,AV,AV,BDL,SVC,NRAL,Results,Principal Investigator,,"1: Metadata has been QCd by BF2: NA3: QC flags and detection limits added by MK. NH4 analyzed with 'UV' method. Later method is switched to 'Fluo' and results seem more stable and better detectable.4: Results QC'ed by KS."
,3705,1,6/25/2013,CALVERT,HAKAI,FGS,1,1015 OUTLET,64,NUT4534,F,51.690527,-128.067788,,,,0,,0.45nm,13,,2013-06-25T14:52:03.000Z,2013-06-25T07:00:00.000Z,2013-11-25T08:00:00.000Z,,27.3,,,,13.8,16.7,310.7,331.2,,,,,,1.4,,25.5,SVC,NA,AV,SVD,AV,AV,NA,NA,NA,BDL,BDL,AV,BDL,SVC,NRAL,Results,Principal Investigator,,"1: Metadata has been QCd by BF2: NA3: QC flags and detection limits added by MK. NH4 analyzed with 'UV' method. Later method is switched to 'Fluo' and results seem more stable and better detectable.4: Results QC'ed by KS."
,3706,1,6/25/2013,CALVERT,HAKAI,FGS,1,819 OUTLET,67,NUT4535,F,51.657375,-128.042222,,,,0,,0.45nm,13,,2013-06-25T15:36:04.000Z,2013-06-25T07:00:00.000Z,2013-11-25T08:00:00.000Z,,33.2,,,,6.1,21.7,422,390.3,,,,,,1.1,6.1,21,SVC,NA,AV,SVD,AV,AV,NA,NA,NA,BDL,BDL,AV,AV,SVC,NRAL,Results,Principal Investigator,,"1: Metadata has been QCd by BF2: NA3: QC flags and detection limits added by MK. NH4 analyzed with 'UV' method. Later method is switched to 'Fluo' and results seem more stable and better detectable.4: Results QC'ed by KS."
,3707,1,6/25/2013,CALVERT,HAKAI,FGS,1,844 OUTLET,61,NUT4536,F,51.658183,-128.002068,,,,0,,0.45nm,13,,2013-06-25T16:18:21.000Z,2013-06-25T07:00:00.000Z,2013-11-25T08:00:00.000Z,,29.1,,,,10.3,18.8,372,336.1,,,,1.7,5.2,8.8,5.4,,SVC,NA,AV,SVD,AV,AV,NA,NA,NA,AV,AV,AV,AV,BDL,NRAL,Results,Principal Investigator,,"1: Metadata has been QCd by BF2: NA3: QC flags and detection limits added by MK. NH4 analyzed with 'UV' method. Later method is switched to 'Fluo' and results seem more stable and better detectable.4: Results QC'ed by KS."
,3708,1,6/25/2013,CALVERT,HAKAI,FGS,1,693 OUTLET,66,NUT4537,F,51.647923,-127.996399,,,,0,,0.45nm,13,,2013-06-25T16:57:05.000Z,2013-06-25T07:00:00.000Z,2013-11-25T08:00:00.000Z,,,,,,3.9,12.5,224.3,224.8,,,,3,,3.6,6.4,,BDL,NA,AV,SVD,AV,AV,NA,NA,NA,AV,BDL,AV,AV,BDL,NRAL,Results,Principal Investigator,,"1: Metadata has been QCd by BF2: NA3: QC flags and detection limits added by MK. NH4 analyzed with 'UV' method. Later method is switched to 'Fluo' and results seem more stable and better detectable.4: Results QC'ed by KS."
,3709,1,6/25/2013,CALVERT,HAKAI,FGS,1,703 OUTLET,65,NUT4538,F,51.64853,-128.026062,,,,0,,0.45nm,13,,2013-06-25T17:45:18.000Z,2013-06-25T07:00:00.000Z,2013-11-25T08:00:00.000Z,,,,,,7.8,57.8,263.8,250.8,,,,,,1.6,24.5,,BDL,NA,AV,SVD,AV,AV,NA,NA,NA,BDL,BDL,AV,AV,BDL,NRAL,Results,Principal Investigator,,"1: Metadata has been QCd by BF2: NA3: QC flags and detection limits added by MK. NH4 analyzed with 'UV' method. Later method is switched to 'Fluo' and results seem more stable and better detectable.4: Results QC'ed by KS."
,3709,2,6/25/2013,CALVERT,HAKAI,FGS,1,703 OUTLET,68,NUT4539,F,51.64853,-128.026062,,,,0,,0.45nm,13,,2013-06-25T17:45:39.000Z,2013-06-25T07:00:00.000Z,2013-11-25T08:00:00.000Z,,,,,,8.2,15.3,255.9,245.1,,,,4.2,24.4,1.4,29.2,,BDL,NA,AV,SVD,AV,AV,NA,NA,NA,SVD,AV,AV,AV,BDL,NRAL,Results,Principal Investigator,,"1: Metadata has been QCd by BF2: NA3: QC flags and detection limits added by MK. NH4 analyzed with 'UV' method. Later method is switched to 'Fluo' and results seem more stable and better detectable.4: Results QC'ed by KS."
,3709,3,6/25/2013,CALVERT,HAKAI,FGS,1,703 OUTLET,69,NUT4540,F,51.64853,-128.026062,,,,0,,0.45nm,13,,2013-06-25T17:37:12.000Z,2013-06-25T07:00:00.000Z,2013-11-25T08:00:00.000Z,,,,,,5.6,16.6,261.7,249.9,,,,,23.8,13.4,35.2,,BDL,NA,AV,SVD,AV,AV,NA,NA,NA,BDL,AV,SVD,AV,BDL,NRAL,Results,Principal Investigator,,"1: Metadata has been QCd by BF2: NA3: QC flags and detection limits added by MK. NH4 analyzed with 'UV' method. Later method is switched to 'Fluo' and results seem more stable and better detectable.4: Results QC'ed by KS."
,3712,1,6/25/2013,CALVERT,HAKAI,FGS,1,708 OUTLET,70,NUT4541,F,51.649199,-128.068516,,,,0,,0.45nm,13,,2013-06-25T19:36:55.000Z,2013-06-25T07:00:00.000Z,2013-11-25T08:00:00.000Z,,20.9,,,,19.8,33.4,255.2,244.3,,,,5.4,8,,,,SVC,NA,AV,SVD,AV,AV,NA,NA,NA,AV,AV,BDL,BDL,BDL,NRAL,Results,Principal Investigator,,"1: Metadata has been QCd by BF2: NA3: QC flags and detection limits added by MK. NH4 analyzed with 'UV' method. Later method is switched to 'Fluo' and results seem more stable and better detectable.4: Results QC'ed by KS."
,3713,1,7/9/2013,CALVERT,HAKAI,FGS,1,1015 OUTLET,58,NUT4542,F,51.690527,-128.067788,,,,0,,0.45nm,13,,2013-07-09T13:43:22.000Z,2013-07-09T07:00:00.000Z,2013-11-25T08:00:00.000Z,,,,,,9.7,351.6,234.1,251.7,,,,,,,,,BDL,NA,AV,SVD,AV,AV,NA,NA,NA,BDL,BDL,BDL,BDL,BDL,NRAL,Results,Principal Investigator,,"1: Metadata has been QCd by BF2: NA3: QC flags and detection limits added by MK. NH4 analyzed with 'UV' method. Later method is switched to 'Fluo' and results seem more stable and better detectable.4: Results QC'ed by KS."
,3714,2,7/9/2013,CALVERT,HAKAI,FGS,1,819 OUTLET,60,NUT4543,F,51.657375,-128.042222,,,,0,,0.45nm,13,,2013-07-09T14:25:57.000Z,2013-07-09T07:00:00.000Z,2013-11-25T08:00:00.000Z,,,,,,4.8,5.4,312.8,310.2,,,,2.5,7.4,,,,BDL,NA,AV,AV,AV,AV,NA,NA,NA,AV,AV,BDL,BDL,BDL,NRAL,Results,Principal Investigator,,"1: Metadata has been QCd by BF2: NA3: QC flags and detection limits added by MK. NH4 analyzed with 'UV' method. Later method is switched to 'Fluo' and results seem more stable and better detectable.4: Results QC'ed by KS."
,3714,1,7/9/2013,CALVERT,HAKAI,FGS,1,819 OUTLET,59,NUT4544,F,51.657375,-128.042222,,,,0,,0.45nm,13,,2013-07-09T14:43:10.000Z,2013-07-09T07:00:00.000Z,2013-11-25T08:00:00.000Z,,,,,,5,87.5,309,314.1,,,,,7,,,,BDL,NA,AV,SVD,AV,AV,NA,NA,NA,BDL,AV,BDL,BDL,BDL,NRAL,Results,Principal Investigator,,"1: Metadata has been QCd by BF2: NA3: QC flags and detection limits added by MK. NH4 analyzed with 'UV' method. Later method is switched to 'Fluo' and results seem more stable and better detectable.4: Results QC'ed by KS."
,3716,1,7/9/2013,CALVERT,HAKAI,FGS,1,844 OUTLET,53,NUT4545,F,51.658183,-128.002068,,,,0,,0.45nm,13,,2013-07-09T15:09:47.000Z,2013-07-09T07:00:00.000Z,2013-11-25T08:00:00.000Z,,,,,,7.7,3.8,279.3,287.9,,,,2.3,6.2,,8.6,,BDL,NA,AV,AV,AV,AV,NA,NA,NA,AV,AV,BDL,AV,BDL,NRAL,Results,Principal Investigator,,"1: Metadata has been QCd by BF2: NA3: QC flags and detection limits added by MK. NH4 analyzed with 'UV' method. Later method is switched to 'Fluo' and results seem more stable and better detectable.4: Results QC'ed by KS."
,3717,1,7/9/2013,CALVERT,HAKAI,FGS,1,693 OUTLET,55,NUT4546,F,51.647923,-127.996399,,,,0,,0.45nm,13,,2013-07-09T15:40:57.000Z,2013-07-09T07:00:00.000Z,2013-11-25T08:00:00.000Z,,,,,,8.1,5.2,225.7,231.1,,,,1.9,,,,,BDL,NA,AV,AV,AV,AV,NA,NA,NA,AV,BDL,BDL,BDL,BDL,NRAL,Results,Principal Investigator,,"1: Metadata has been QCd by BF2: NA3: QC flags and detection limits added by MK. NH4 analyzed with 'UV' method. Later method is switched to 'Fluo' and results seem more stable and better detectable.4: Results QC'ed by KS."
,3718,1,7/9/2013,CALVERT,HAKAI,FGS,1,703 OUTLET,56,NUT4547,F,51.64853,-128.026062,,,,0,,0.45nm,13,,2013-07-09T16:12:44.000Z,2013-07-09T07:00:00.000Z,2013-11-25T08:00:00.000Z,,,,,,2,17.5,204,234.8,,,,,52.5,,48.5,,BDL,NA,AV,SVD,AV,SVD,NA,NA,NA,BDL,AV,BDL,AV,BDL,NRAL,Results,Principal Investigator,,"1: Metadata has been QCd by BF2: NA3: QC flags and detection limits added by MK. NH4 analyzed with 'UV' method. Later method is switched to 'Fluo' and results seem more stable and better detectable.4: Results QC'ed by KS."
,3719,1,7/9/2013,CALVERT,HAKAI,FGS,1,708 OUTLET,52,NUT4548,F,51.649199,-128.068516,,,,0,,0.45nm,13,,2013-07-09T16:48:27.000Z,2013-07-09T07:00:00.000Z,2013-11-25T08:00:00.000Z,,,,,,4.4,9.3,246.2,233.2,,,,3.9,,,,,BDL,NA,AV,SVD,AV,AV,NA,NA,NA,AV,BDL,BDL,BDL,BDL,NRAL,Results,Principal Investigator,,"1: Metadata has been QCd by BF2: NA3: QC flags and detection limits added by MK. NH4 analyzed with 'UV' method. Later method is switched to 'Fluo' and results seem more stable and better detectable.4: Results QC'ed by KS."
,3720,1,7/9/2013,CALVERT,HAKAI,FGS,1,626 OUTLET,57,NUT4549,F,51.641718,-128.120582,,,,0,,0.45nm,13,,2013-07-09T17:34:25.000Z,2013-07-09T07:00:00.000Z,2013-11-25T08:00:00.000Z,,,,,,476,11.1,425.7,421.5,,,,3.9,,4.5,,,BDL,NA,SVD,AV,AV,AV,NA,NA,NA,AV,BDL,AV,BDL,BDL,NRAL,Results,Principal Investigator,,"1: Metadata has been QCd by BF2: NA3: QC flags and detection limits added by MK. NH4 analyzed with 'UV' method. Later method is switched to 'Fluo' and results seem more stable and better detectable.4: Results QC'ed by KS."
,3721,1,7/23/2013,CALVERT,HAKAI,FGS,1,708 OUTLET,50,NUT4550,F,51.649199,-128.068516,,,,0,,0.45nm,13,,2013-07-23T14:54:31.000Z,2013-07-23T07:00:00.000Z,2013-11-25T08:00:00.000Z,,24.1,,,,,10.1,300.9,329.8,,,,2.3,,,,30.2,SVC,NA,BDL,AV,AV,AV,NA,NA,NA,AV,BDL,BDL,BDL,SVC,NRAL,Results,Principal Investigator,,"1: DO readin gs highly variable; hard to stabilize; and out of typical range onsites WTS 703. Flag and discard this reading. DO readings stabilized as usual and produced values in expected range- WTS 708; 693; 844; 626; 10152: DO readings highly variable; hard to stabilize; and out of typical range onsites WTS 703. Flag and discard this reading. DO readings stabilized as usual and produced values in expected range- WTS 708; 693; 844; 626; 10153: Metadata has been QCd by BF4: QC flags and detection limits added by MK. NH4 analyzed with 'UV' method. Later method is switched to 'Fluo' and results seem more stable and better detectable.5: Results QC'ed by KS."
,3722,1,7/23/2013,CALVERT,HAKAI,FGS,1,703 OUTLET,43,NUT4551,F,51.64853,-128.026062,,,,0,,0.45nm,13,,2013-07-23T15:43:11.000Z,2013-07-23T07:00:00.000Z,2013-11-25T08:00:00.000Z,,,,,,8.2,10.5,257.9,314.8,,,,1.1,58.5,1.9,63.4,,BDL,NA,AV,SVD,AV,SVD,NA,NA,NA,AV,AV,AV,AV,BDL,NRAL,Results,Principal Investigator,,"1: DO readings highly variable; hard to stabilize; and out of typical range onsites WTS 703. Flag and discard this reading. DO readings stabilized as usual and produced values in expected range- WTS 708; 693; 844; 626; 10152: Metadata has been QCd by BF3: QC flags and detection limits added by MK. NH4 analyzed with 'UV' method. Later method is switched to 'Fluo' and results seem more stable and better detectable.4: Results QC'ed by KS."
,3723,1,7/23/2013,CALVERT,HAKAI,FGS,1,693 OUTLET,41,NUT4552,F,51.647923,-127.996399,,,,0,,0.45nm,13,,2013-07-23T16:19:12.000Z,2013-07-23T07:00:00.000Z,2013-11-25T08:00:00.000Z,,,,,,10.6,10.8,281.4,283.1,,,,1.1,8.5,,7.4,,BDL,NA,AV,AV,AV,AV,NA,NA,NA,AV,AV,BDL,AV,BDL,NRAL,Results,Principal Investigator,,"1: DO readings highly variable; hard to stabilize; and out of typical range onsites WTS 703. Flag and discard this reading. DO readings stabilized as usual and produced values in expected range- WTS 708; 693; 844; 626; 10152: Metadata has been QCd by BF3: QC flags and detection limits added by MK. NH4 analyzed with 'UV' method. Later method is switched to 'Fluo' and results seem more stable and better detectable.4: Results QC'ed by KS."
,3724,1,7/23/2013,CALVERT,HAKAI,FGS,1,626 OUTLET,48,NUT4553,F,51.641718,-128.120582,,,,0,,0.45nm,13,,2013-07-23T20:07:22.000Z,2013-07-23T07:00:00.000Z,2013-11-25T08:00:00.000Z,,,,,,13.4,,414.6,,,,,,,,,25.2,NA,NA,AV,BDL,AV,BDL,NA,NA,NA,BDL,BDL,BDL,BDL,SVC,NRAL,Results,Principal Investigator,,"1: DO readings highly variable; hard to stabilize; and out of typical range onsites WTS 703. Flag and discard this reading. DO readings stabilized as usual and produced values in expected range- WTS 708; 693; 844; 626; 10152: Metadata has been QCd by BF3: QC flags and detection limits added by MK.4: QC flags and detection limits added by MK. NH4 analyzed with 'UV' method. Later method is switched to 'Fluo' and results seem more stable and better detectable.5: Results QC'ed by KS."
,3725,1,7/23/2013,CALVERT,HAKAI,FGS,1,844 OUTLET,42,NUT4554,F,51.658183,-128.002068,,,,0,,0.45nm,13,,2013-07-23T17:34:34.000Z,2013-07-23T07:00:00.000Z,2013-11-25T08:00:00.000Z,,,,,,6.1,4,353.7,243.3,,,,1.6,25.7,1.1,32.8,30.5,BDL,NA,AV,AV,AV,AV,NA,NA,NA,SVD,AV,AV,SVC,SVC,NRAL,Results,Principal Investigator,,"1: DO readings highly variable; hard to stabilize; and out of typical range onsites WTS 703. Flag and discard this reading. DO readings stabilized as usual and produced values in expected range- WTS 708; 693; 844; 626; 10152: Metadata has been QCd by BF3: QC flags and detection limits added by MK. NH4 analyzed with 'UV' method. Later method is switched to 'Fluo' and results seem more stable and better detectable.4: Results QC'ed by KS."
,3725,2,7/23/2013,CALVERT,HAKAI,FGS,1,844 OUTLET,44,NUT4555,F,51.658183,-128.002068,,,,0,,0.45nm,13,,2013-07-23T17:34:34.000Z,2013-07-23T07:00:00.000Z,2013-11-25T08:00:00.000Z,,,,,,11.9,5.8,450,313.9,,,,1.8,33.2,,29.4,,BDL,NA,AV,AV,SVC,SVC,NA,NA,NA,AV,AV,BDL,AV,BDL,NRAL,Results,Principal Investigator,,"1: DO readings highly variable; hard to stabilize; and out of typical range onsites WTS 703. Flag and discard this reading. DO readings stabilized as usual and produced values in expected range- WTS 708; 693; 844; 626; 10152: Metadata has been QCd by BF3: QC flags and detection limits added by MK. NH4 analyzed with 'UV' method. Later method is switched to 'Fluo' and results seem more stable and better detectable.4: Results QC'ed by KS."
,3727,1,7/23/2013,CALVERT,HAKAI,FGS,1,1015 OUTLET,46,NUT4556,F,51.690527,-128.067788,,,,0,,0.45nm,13,,2013-07-23T18:51:21.000Z,2013-07-23T07:00:00.000Z,2013-11-25T08:00:00.000Z,,,,,,5.6,7.9,274,296.3,,,,1.8,,,,22.3,BDL,NA,AV,SVD,AV,SVC,NA,NA,NA,AV,BDL,BDL,BDL,SVC,NRAL,Results,Principal Investigator,,"1: DO readings highly variable; hard to stabilize; and out of typical range onsites WTS 703. Flag and discard this reading. DO readings stabilized as usual and produced values in expected range- WTS 708; 693; 844; 626; 10152: Metadata has been QCd by BF3: QC flags and detection limits added by MK. NH4 analyzed with 'UV' method. Later method is switched to 'Fluo' and results seem more stable and better detectable.4: Results QC'ed by KS."
,3728,1,7/23/2013,CALVERT,HAKAI,FGS,1,819 OUTLET,49,NUT4557,F,51.657375,-128.042222,,,,0,,0.45nm,13,,2013-07-23T18:05:57.000Z,2013-07-23T07:00:00.000Z,2013-11-25T08:00:00.000Z,,,,,,,,349.8,,,,,,,,44.1,25.9,NA,NA,BDL,BDL,AV,BDL,NA,NA,NA,BDL,BDL,BDL,SVC,SVC,NRAL,Results,Principal Investigator,,"1: DO readings highly variable; hard to stabilize; and out of typical range onsites WTS 703. Flag and discard this reading. DO readings stabilized as usual and produced values in expected range- WTS 708; 693; 844; 626; 10152: Metadata has been QCd by BF3: QC flags and detection limits added by MK.4: QC flags and detection limits added by MK. NH4 analyzed with 'UV' method. Later method is switched to 'Fluo' and results seem more stable and better detectable.5: Results QC'ed by KS."
,3725,3,7/23/2013,CALVERT,HAKAI,FGS,1,844 OUTLET,78,NUT4558,F,51.658183,-128.002068,,,,0,,0.45nm,13,,2013-07-23T17:34:34.000Z,2013-07-23T07:00:00.000Z,2013-11-25T08:00:00.000Z,,24.1,,,,,26.4,301.1,307.3,,,,57.8,36.4,55.9,23.2,25.4,SVC,NA,BDL,SVC,AV,AV,NA,NA,NA,SVD,SVD,SVD,AV,SVC,NRAL,Results,Principal Investigator,,"1: DO readings highly variable; hard to stabilize; and out of typical range onsites WTS 703. Flag and discard this reading. DO readings stabilized as usual and produced values in expected range- WTS 708; 693; 844; 626; 10152: Metadata has been QCd by BF3: QC flags and detection limits added by MK. NH4 analyzed with 'UV' method. Later method is switched to 'Fluo' and results seem more stable and better detectable.4: Results QC'ed by KS."
,3730,1,8/5/2013,CALVERT,HAKAI,FGS,1,1015 OUTLET,93,NUT4559,F,51.690527,-128.067788,,,,0,,0.45nm,13,,2013-08-05T16:58:34.000Z,2013-08-05T07:00:00.000Z,2013-11-25T08:00:00.000Z,,,,,,13.5,49.3,382.5,440.6,,,,19.4,19.4,,43.8,31.5,BDL,NA,AV,SVD,SVC,SVD,NA,NA,NA,AV,SVC,BDL,SVC,SVC,NRAL,Results,Principal Investigator,,"1: First Day for marine D.O.C2: Metadata has been QCd by BF3: QC flags and detection limits added by MK. NH4 analyzed with 'UV' method. Later method is switched to 'Fluo' and results seem more stable and better detectable.4: Results QC'ed by KS."
,3731,1,8/5/2013,CALVERT,HAKAI,FGS,1,819 OUTLET,94,NUT4560,F,51.657375,-128.042222,,,,0,,0.45nm,13,,2013-08-05T17:44:58.000Z,2013-08-05T07:00:00.000Z,2013-11-25T08:00:00.000Z,,,,,,8.1,45.6,450.5,510.4,,,,18.2,126.9,,150.9,34.8,BDL,NA,AV,SVD,SVC,SVC,NA,NA,NA,SVC,SVD,BDL,SVD,SVC,NRAL,Results,Principal Investigator,,"1: First Day for marine D.O.C2: Metadata has been QCd by BF3: QC flags and detection limits added by MK. NH4 analyzed with 'UV' method. Later method is switched to 'Fluo' and results seem more stable and better detectable.4: Results QC'ed by KS."
,3732,1,8/5/2013,CALVERT,HAKAI,FGS,1,844 OUTLET,95,NUT4561,F,51.658183,-128.002068,,,,0,,0.45nm,13,,2013-08-05T18:22:48.000Z,2013-08-05T07:00:00.000Z,2013-11-25T08:00:00.000Z,,30.4,,,,8.6,68.8,371,402.8,,,,23.2,117.8,,107.9,38.6,SVC,NA,AV,SVD,AV,AV,NA,NA,NA,SVC,SVC,BDL,SVC,SVC,NRAL,Results,Principal Investigator,,"1: First Day for marine D.O.C2: Metadata has been QCd by BF3: QC flags and detection limits added by MK. NH4 analyzed with 'UV' method. Later method is switched to 'Fluo' and results seem more stable and better detectable.4: Results QC'ed by KS."
,3733,1,8/5/2013,CALVERT,HAKAI,FGS,1,626 OUTLET,97,NUT4562,F,51.641718,-128.120582,,,,0,,0.45nm,13,,2013-08-05T20:27:03.000Z,2013-08-05T07:00:00.000Z,2013-11-25T08:00:00.000Z,,33.9,,,,3.9,15.8,231.6,345.4,,,,5.9,113.3,5.5,17.4,30.6,SVC,NA,AV,SVD,AV,SVD,NA,NA,NA,AV,SVD,SVD,AV,SVC,NRAL,Results,Principal Investigator,,"1: First Day for marine D.O.C2: Metadata has been QCd by BF3: QC flags and detection limits added by MK. NH4 analyzed with 'UV' method. Later method is switched to 'Fluo' and results seem more stable and better detectable.4: Results QC'ed by KS."
,3734,1,8/5/2013,CALVERT,HAKAI,FGS,1,708 OUTLET,99,NUT4563,F,51.649199,-128.068516,,,,0,,0.45nm,13,,2013-08-05T21:33:20.000Z,2013-08-05T07:00:00.000Z,2013-11-25T08:00:00.000Z,,36.1,,,,3.9,13.1,239.4,276.1,,,,4.9,113.9,,17.6,33.9,SVC,NA,AV,SVD,AV,SVD,NA,NA,NA,AV,SVD,BDL,AV,SVC,NRAL,Results,Principal Investigator,,"1: First Day for marine D.O.C2: Metadata has been QCd by BF3: QC flags and detection limits added by MK. NH4 analyzed with 'UV' method. Later method is switched to 'Fluo' and results seem more stable and better detectable.4: Results QC'ed by KS."
,3735,1,8/5/2013,CALVERT,HAKAI,FGS,1,703 OUTLET,96,NUT4564,F,51.64853,-128.026062,,,,0,,0.45nm,13,,2013-08-05T22:20:41.000Z,2013-08-05T07:00:00.000Z,2013-11-25T08:00:00.000Z,,,,,,,6,179,197.8,,,,4.5,118.6,,80.9,28.4,BDL,NA,BDL,AV,AV,AV,NA,NA,NA,SVC,SVD,BDL,AV,SVC,NRAL,Results,Principal Investigator,,"1: First Day for marine D.O.C2: Metadata has been QCd by BF3: QC flags and detection limits added by MK. NH4 analyzed with 'UV' method. Later method is switched to 'Fluo' and results seem more stable and better detectable.4: Results QC'ed by KS."
,3736,2,8/5/2013,CALVERT,HAKAI,FGS,1,693 OUTLET,91,NUT4565,F,51.647923,-127.996399,,,,0,,0.45nm,13,,2013-08-05T23:15:15.000Z,2013-08-05T07:00:00.000Z,2013-11-25T08:00:00.000Z,,22.1,,,,6.7,27.9,308.2,347.7,,,,21.8,85.9,1.8,96.3,29.3,SVC,NA,AV,SVD,AV,AV,NA,NA,NA,SVD,SVC,AV,SVC,SVC,NRAL,Results,Principal Investigator,,"1: First Day for marine D.O.C2: Metadata has been QCd by BF3: QC flags and detection limits added by MK. NH4 analyzed with 'UV' method. Later method is switched to 'Fluo' and results seem more stable and better detectable.4: Results QC'ed by KS."
,3736,3,8/5/2013,CALVERT,HAKAI,FGS,1,693 OUTLET,92,NUT4566,F,51.647923,-127.996399,,,,0,,0.45nm,13,,2013-08-05T23:15:15.000Z,2013-08-05T07:00:00.000Z,2013-11-25T08:00:00.000Z,,24.8,,,,3.7,22.5,370.1,387.4,,,,8,110.9,,124.9,27.9,SVC,NA,AV,SVD,SVC,SVC,NA,NA,NA,AV,SVC,BDL,SVC,SVC,NRAL,Results,Principal Investigator,,"1: First Day for marine D.O.C2: Metadata has been QCd by BF3: QC flags and detection limits added by MK. NH4 analyzed with 'UV' method. Later method is switched to 'Fluo' and results seem more stable and better detectable.4: Results QC'ed by KS."
,3736,1,8/5/2013,CALVERT,HAKAI,FGS,1,693 OUTLET,100,NUT4567,F,51.647923,-127.996399,,,,0,,0.45nm,13,,2013-08-05T23:15:15.000Z,2013-08-05T07:00:00.000Z,2013-11-25T08:00:00.000Z,,30,,,,4,22.6,315.8,318.1,,,,15.6,178.4,35.6,120.4,38.5,SVC,NA,AV,SVD,AV,AV,NA,NA,NA,SVC,SVD,SVD,SVC,SVC,NRAL,Results,Principal Investigator,,"1: First Day for marine D.O.C2: Metadata has been QCd by BF3: QC flags and detection limits added by MK. NH4 analyzed with 'UV' method. Later method is switched to 'Fluo' and results seem more stable and better detectable.4: Results QC'ed by KS."
,3739,1,8/19/2013,CALVERT,HAKAI,FGS,1,819 OUTLET,88,NUT4568,F,51.657375,-128.042222,,,,0,,0.45nm,13,,2013-08-19T16:01:28.000Z,2013-08-19T07:00:00.000Z,2013-11-25T08:00:00.000Z,,49.8,,,,7.7,8.4,467.4,488.5,,,,4,22.7,8.7,9.9,28.6,SVC,NA,AV,AV,SVC,SVC,NA,NA,NA,AV,SVD,AV,AV,SVC,NRAL,Results,Principal Investigator,,"1: Metadata has been QCd by BF2: NA3: QC flags and detection limits added by MK. NH4 analyzed with 'UV' method. Later method is switched to 'Fluo' and results seem more stable and better detectable.4: Results QC'ed by KS."
,3740,1,8/19/2013,CALVERT,HAKAI,FGS,1,844 OUTLET,87,NUT4569,F,51.658183,-128.002068,,,,0,,0.45nm,13,,2013-08-19T16:52:58.000Z,2013-08-19T07:00:00.000Z,2013-11-25T08:00:00.000Z,,35.1,,,,4.9,10.6,463.6,530,,,,2.4,26.7,,,36.9,SVC,NA,AV,SVD,SVC,SVC,NA,NA,NA,AV,SVC,BDL,BDL,SVC,NRAL,Results,Principal Investigator,,"1: Metadata has been QCd by BF2: NA3: QC flags and detection limits added by MK. NH4 analyzed with 'UV' method. Later method is switched to 'Fluo' and results seem more stable and better detectable.4: Results QC'ed by KS."
,3741,1,8/19/2013,CALVERT,HAKAI,FGS,1,693 OUTLET,82,NUT4570,F,51.647923,-127.996399,,,,0,,0.45nm,13,,2013-08-19T17:31:17.000Z,2013-08-19T07:00:00.000Z,2013-11-25T08:00:00.000Z,,,,,,6,16.9,240.5,236.4,,,,10.8,24.3,,12.8,,BDL,NA,AV,SVD,AV,AV,NA,NA,NA,SVC,SVD,BDL,AV,BDL,NRAL,Results,Principal Investigator,,"1: Metadata has been QCd by BF2: NA3: QC flags and detection limits added by MK. NH4 analyzed with 'UV' method. Later method is switched to 'Fluo' and results seem more stable and better detectable.4: Results QC'ed by KS."
,3742,1,8/19/2013,CALVERT,HAKAI,FGS,1,626 OUTLET,90,NUT4571,F,51.641718,-128.120582,,,,0,,0.45nm,13,,2013-08-19T20:24:50.000Z,2013-08-19T07:00:00.000Z,2013-11-25T08:00:00.000Z,,35.5,,,,17.1,16.2,613.4,546,,,,4,11.9,,,32.6,SVC,NA,AV,AV,SVC,SVC,NA,NA,NA,AV,AV,BDL,BDL,SVC,NRAL,Results,Principal Investigator,,"1: Metadata has been QCd by BF2: NA3: QC flags and detection limits added by MK. NH4 analyzed with 'UV' method. Later method is switched to 'Fluo' and results seem more stable and better detectable.4: Results QC'ed by KS."
,3743,1,8/19/2013,CALVERT,HAKAI,FGS,1,708 OUTLET,81,NUT4572,F,51.649199,-128.068516,,,,0,,0.45nm,13,,2013-08-19T21:13:46.000Z,2013-08-19T07:00:00.000Z,2013-11-25T08:00:00.000Z,,20.7,,,,8.5,7.8,382.8,332.4,,,,4.8,40,,12.4,54.8,SVC,NA,AV,AV,SVC,SVC,NA,NA,NA,AV,SVD,BDL,AV,SVC,NRAL,Results,Principal Investigator,,"1: Metadata has been QCd by BF2: NA3: QC flags and detection limits added by MK. NH4 analyzed with 'UV' method. Later method is switched to 'Fluo' and results seem more stable and better detectable.4: Results QC'ed by KS."
,3743,2,8/19/2013,CALVERT,HAKAI,FGS,1,708 OUTLET,83,NUT4573,F,51.649199,-128.068516,,,,0,,0.45nm,13,,2013-08-19T21:13:46.000Z,2013-08-19T07:00:00.000Z,2013-11-25T08:00:00.000Z,,56.4,,,,7.3,8.1,366.5,400.5,,,,1.9,23.2,,30.1,39.1,SVC,NA,AV,AV,SVC,SVC,NA,NA,NA,AV,SVC,BDL,AV,SVC,NRAL,Results,Principal Investigator,,"1: Metadata has been QCd by BF2: NA3: QC flags and detection limits added by MK. NH4 analyzed with 'UV' method. Later method is switched to 'Fluo' and results seem more stable and better detectable.4: Results QC'ed by KS."
,3743,3,8/19/2013,CALVERT,HAKAI,FGS,1,708 OUTLET,84,NUT4574,F,51.649199,-128.068516,,,,0,,0.45nm,13,,2013-08-19T21:13:46.000Z,2013-08-19T07:00:00.000Z,2013-11-25T08:00:00.000Z,,31.5,,,,11.3,10.6,457.9,350.7,,,,2.7,14,,,,SVC,NA,AV,AV,SVC,SVC,NA,NA,NA,AV,AV,BDL,BDL,BDL,NRAL,Results,Principal Investigator,,"1: Metadata has been QCd by BF2: NA3: QC flags and detection limits added by MK. NH4 analyzed with 'UV' method. Later method is switched to 'Fluo' and results seem more stable and better detectable.4: Results QC'ed by KS."
,3746,1,8/19/2013,CALVERT,HAKAI,FGS,1,703 OUTLET,86,NUT4575,F,51.64853,-128.026062,,,,0,,0.45nm,13,,2013-08-19T22:45:57.000Z,2013-08-19T07:00:00.000Z,2013-11-25T08:00:00.000Z,,,,,,15.1,11.9,399,357.5,,,,1.1,20.7,,,29.3,BDL,NA,AV,AV,SVC,SVC,NA,NA,NA,AV,AV,BDL,BDL,SVC,NRAL,Results,Principal Investigator,,"1: Metadata has been QCd by BF2: NA3: QC flags and detection limits added by MK. NH4 analyzed with 'UV' method. Later method is switched to 'Fluo' and results seem more stable and better detectable.4: Results QC'ed by KS."
,3747,1,8/19/2013,CALVERT,HAKAI,FGS,1,1015 OUTLET,85,NUT4576,F,51.690527,-128.067788,,,,0,,0.45nm,13,,2013-08-19T23:33:04.000Z,2013-08-19T07:00:00.000Z,2013-11-25T08:00:00.000Z,,,,,,12.7,8.6,369.1,300.5,,,,2.6,16.3,,,,BDL,NA,AV,AV,SVC,SVC,NA,NA,NA,AV,SVC,BDL,BDL,BDL,NRAL,Results,Principal Investigator,,"1: Metadata has been QCd by BF2: NA3: QC flags and detection limits added by MK. NH4 analyzed with 'UV' method. Later method is switched to 'Fluo' and results seem more stable and better detectable.4: Results QC'ed by KS."
,3748,1,9/2/2013,CALVERT,HAKAI,FGS,1,819 OUTLET,104,NUT4577,F,51.657375,-128.042222,,,,0,,0.45nm,13,,2013-09-02T16:18:32.000Z,2013-09-02T07:00:00.000Z,2013-11-25T08:00:00.000Z,,22.6,,,,6.7,5.6,287.5,310.1,,,,7.1,10,,12.1,,SVC,NA,AV,AV,AV,AV,NA,NA,NA,SVD,AV,BDL,AV,BDL,NRAL,Results,Principal Investigator,,"1: Metadata has been QCd by BF2: QC flags and detection limits added by MK. NH4 analyzed with 'UV' method. Later method is switched to 'Fluo' and results seem more stable and better detectable.3: Results QC'ed by KS.4: Screened POMs with 500 micron sieve; procedure to start from this date forward"
,3749,2,9/2/2013,CALVERT,HAKAI,FGS,1,844 OUTLET,102,NUT4578,F,51.658183,-128.002068,,,,0,,0.45nm,13,,2013-09-02T17:08:05.000Z,2013-09-02T07:00:00.000Z,2013-11-25T08:00:00.000Z,,37.9,,,,5.9,7.3,277.5,327.2,,,,3.2,8,,6.2,39.4,SVC,NA,AV,SVD,AV,SVD,NA,NA,NA,AV,SVD,BDL,AV,SVC,NRAL,Results,Principal Investigator,,"1: Metadata has been QCd by BF2: QC flags and detection limits added by MK. NH4 analyzed with 'UV' method. Later method is switched to 'Fluo' and results seem more stable and better detectable.3: Results QC'ed by KS.4: Screened POMs with 500 micron sieve; procedure to start from this date forward"
,3749,1,9/2/2013,CALVERT,HAKAI,FGS,1,844 OUTLET,101,NUT4579,F,51.658183,-128.002068,,,,0,,0.45nm,13,,2013-09-02T17:29:13.000Z,2013-09-02T07:00:00.000Z,2013-11-25T08:00:00.000Z,,57.7,,,,2.8,3.2,266.9,274.5,,,,1.1,8.8,,,30.9,SVC,NA,AV,AV,AV,AV,NA,NA,NA,AV,AV,BDL,BDL,SVC,NRAL,Results,Principal Investigator,,"1: Metadata has been QCd by BF2: QC flags and detection limits added by MK. NH4 analyzed with 'UV' method. Later method is switched to 'Fluo' and results seem more stable and better detectable.3: Results QC'ed by KS.4: Screened POMs with 500 micron sieve; procedure to start from this date forward"
,3749,3,9/2/2013,CALVERT,HAKAI,FGS,1,844 OUTLET,110,NUT4580,F,51.658183,-128.002068,,,,0,,0.45nm,13,,2013-09-02T17:48:43.000Z,2013-09-02T07:00:00.000Z,2013-11-25T08:00:00.000Z,,,,,,2.8,4.6,268,350.2,,,,1.4,13.4,,6.8,,BDL,NA,AV,SVD,AV,SVD,NA,NA,NA,AV,SVD,BDL,AV,BDL,NRAL,Results,Principal Investigator,,"1: Metadata has been QCd by BF2: QC flags and detection limits added by MK. NH4 analyzed with 'UV' method. Later method is switched to 'Fluo' and results seem more stable and better detectable.3: Results QC'ed by KS.4: Screened POMs with 500 micron sieve; procedure to start from this date forward"
,3752,1,9/2/2013,CALVERT,HAKAI,FGS,1,693 OUTLET,109,NUT4581,F,51.647923,-127.996399,,,,0,,0.45nm,13,,2013-09-02T18:49:18.000Z,2013-09-02T07:00:00.000Z,2013-11-25T08:00:00.000Z,,,,,,5.2,2.9,284.2,295.6,,,,,,,12.6,24.9,BDL,NA,AV,AV,AV,AV,NA,NA,NA,BDL,BDL,BDL,AV,SVC,NRAL,Results,Principal Investigator,,"1: Metadata has been QCd by BF2: QC flags and detection limits added by MK. NH4 analyzed with 'UV' method. Later method is switched to 'Fluo' and results seem more stable and better detectable.3: Results QC'ed by KS.4: Screened POMs with 500 micron sieve; procedure to start from this date forward"
,3753,1,9/2/2013,CALVERT,HAKAI,FGS,1,626 OUTLET,108,NUT4582,F,51.641718,-128.120582,,,,0,,0.45nm,13,,2013-09-02T22:02:30.000Z,2013-09-02T07:00:00.000Z,2013-11-25T08:00:00.000Z,,27.2,,,,17.8,9.9,489.1,482.1,,,,,5.5,,20.3,25.2,SVC,NA,AV,AV,AV,SVC,NA,NA,NA,BDL,AV,BDL,AV,SVC,NRAL,Results,Principal Investigator,,"1: Metadata has been QCd by BF2: QC flags and detection limits added by MK. NH4 analyzed with 'UV' method. Later method is switched to 'Fluo' and results seem more stable and better detectable.3: Results QC'ed by KS.4: Screened POMs with 500 micron sieve; procedure to start from this date forward"
,3754,1,9/2/2013,CALVERT,HAKAI,FGS,1,708 OUTLET,107,NUT4583,F,51.649199,-128.068516,,,,0,,0.45nm,13,,2013-09-02T22:54:18.000Z,2013-09-02T07:00:00.000Z,2013-11-25T08:00:00.000Z,,,,,,3.4,4.3,181.7,39.7,,,,,7.3,7.2,26.2,25.1,BDL,NA,AV,SVD,AV,AV,NA,NA,NA,BDL,AV,SVD,SVC,SVC,NRAL,Results,Principal Investigator,,"1: Metadata has been QCd by BF2: QC flags and detection limits added by MK. NH4 analyzed with 'UV' method. Later method is switched to 'Fluo' and results seem more stable and better detectable.3: Results QC'ed by KS.4: Screened POMs with 500 micron sieve; procedure to start from this date forward"
,3755,1,9/2/2013,CALVERT,HAKAI,FGS,1,703 OUTLET,106,NUT4584,F,51.64853,-128.026062,,,,0,,0.45nm,13,,2013-09-02T23:41:55.000Z,2013-09-02T07:00:00.000Z,2013-11-25T08:00:00.000Z,,,,,,4.3,3.7,175.3,134.9,,,,1.1,,,21.5,,BDL,NA,AV,AV,AV,AV,NA,NA,NA,AV,BDL,BDL,AV,BDL,NRAL,Results,Principal Investigator,,"1: Metadata has been QCd by BF2: QC flags and detection limits added by MK. NH4 analyzed with 'UV' method. Later method is switched to 'Fluo' and results seem more stable and better detectable.3: Results QC'ed by KS.4: Screened POMs with 500 micron sieve; procedure to start from this date forward"
,3756,1,9/2/2013,CALVERT,HAKAI,FGS,1,1015 OUTLET,105,NUT4585,F,51.690527,-128.067788,,,,0,,0.45nm,13,,2013-09-03T00:47:31.000Z,2013-09-02T07:00:00.000Z,2013-11-25T08:00:00.000Z,,,,,,4.5,5.5,209.7,246.3,,,,1.1,,,15.3,,BDL,NA,AV,SVD,AV,SVD,NA,NA,NA,AV,BDL,BDL,SVC,BDL,NRAL,Results,Principal Investigator,,"1: Metadata has been QCd by BF2: QC flags and detection limits added by MK. NH4 analyzed with 'UV' method. Later method is switched to 'Fluo' and results seem more stable and better detectable.3: Results QC'ed by KS.4: Screened POMs with 500 micron sieve; procedure to start from this date forward"
,3757,1,9/16/2013,CALVERT,HAKAI,FGS,1,626 OUTLET,113,NUT4586,F,51.641718,-128.120582,,,,0,,0.45nm,13,,2013-09-16T16:26:35.000Z,2013-09-16T07:00:00.000Z,2013-11-25T08:00:00.000Z,,0.7,,,,18.6,8.8,351.9,349.5,,,,,7.4,,5.7,8.4,AV,NA,AV,AV,AV,AV,NA,NA,NA,BDL,SVD,BDL,AV,AV,NRAL,Results,Principal Investigator,,"1: Metadata has been QCd by BF2: QC flags and detection limits added by MK.3: Results QC'ed by KS.4: Visual observation: driest creeks have been all season/extremly low flow"
,3758,1,9/16/2013,CALVERT,HAKAI,FGS,1,703 OUTLET,120,NUT4587,F,51.64853,-128.026062,,,,0,,0.45nm,13,,2013-09-16T17:21:49.000Z,2013-09-16T07:00:00.000Z,2013-11-25T08:00:00.000Z,,3,,,,5.3,4.3,242.7,259.5,,,,,11,,12.3,2.8,AV,NA,AV,AV,AV,SVC,NA,NA,NA,BDL,AV,BDL,AV,AV,NRAL,Results,Principal Investigator,,"1: Metadata has been QCd by BF2: QC flags and detection limits added by MK.3: Results QC'ed by KS.4: Visual observation: driest creeks have been all season/extremly low flow"
,3759,1,9/16/2013,CALVERT,HAKAI,FGS,1,708 OUTLET,111,NUT4588,F,51.649199,-128.068516,,,,0,,0.45nm,13,,2013-09-16T18:12:12.000Z,2013-09-16T07:00:00.000Z,2013-11-25T08:00:00.000Z,,3.6,,,,3.1,2.9,200.9,156.3,,,,1.2,51.5,,62.9,2.5,AV,NA,AV,AV,AV,AV,NA,NA,NA,AV,SVC,BDL,SVC,AV,NRAL,Results,Principal Investigator,,"1: Metadata has been QCd by BF2: QC flags and detection limits added by MK.3: Results QC'ed by KS.4: Visual observation: driest creeks have been all season/extremly low flow"
,3760,1,9/16/2013,CALVERT,HAKAI,FGS,1,693 OUTLET,112,NUT4589,F,51.647923,-127.996399,,,,0,,0.45nm,13,,2013-09-16T19:18:01.000Z,2013-09-16T07:00:00.000Z,2013-11-25T08:00:00.000Z,,7.1,,,,4.5,2.6,249.4,235.3,,,,,14.9,,11.4,1.8,AV,NA,AV,AV,AV,AV,NA,NA,NA,BDL,SVD,BDL,AV,AV,NRAL,Results,Principal Investigator,,"1: Metadata has been QCd by BF2: QC flags and detection limits added by MK.3: Results QC'ed by KS.4: Visual observation: driest creeks have been all season/extremly low flow"
,3760,2,9/16/2013,CALVERT,HAKAI,FGS,1,693 OUTLET,117,NUT4590,F,51.647923,-127.996399,,,,0,,0.45nm,13,,2013-09-16T19:00:27.000Z,2013-09-16T07:00:00.000Z,2013-11-25T08:00:00.000Z,,3,,,,13.3,65,283.2,225,,,,1.2,9.4,,3.1,2.3,AV,NA,AV,SVD,AV,AV,NA,NA,NA,AV,SVD,BDL,AV,AV,NRAL,Results,Principal Investigator,,"1: Metadata has been QCd by BF2: QC flags and detection limits added by MK.3: Results QC'ed by KS.4: Visual observation: driest creeks have been all season/extremly low flow"
,3760,3,9/16/2013,CALVERT,HAKAI,FGS,1,693 OUTLET,119,NUT4591,F,51.647923,-127.996399,,,,0,,0.45nm,13,,2013-09-16T19:34:23.000Z,2013-09-16T07:00:00.000Z,2013-11-25T08:00:00.000Z,,4.9,,,,4.9,4.1,246.8,283,,,,4.4,13.3,,5.2,1.9,AV,NA,AV,AV,AV,AV,NA,NA,NA,AV,SVD,BDL,AV,AV,NRAL,Results,Principal Investigator,,"1: Metadata has been QCd by BF2: QC flags and detection limits added by MK.3: Results QC'ed by KS.4: Visual observation: driest creeks have been all season/extremly low flow"
,3763,1,9/16/2013,CALVERT,HAKAI,FGS,1,844 OUTLET,118,NUT4592,F,51.658183,-128.002068,,,,0,,0.45nm,13,,2013-09-16T20:20:18.000Z,2013-09-16T07:00:00.000Z,2013-11-25T08:00:00.000Z,,1.9,,,,4.3,6.4,269.9,235.6,,,,4.2,30.3,1,19.4,2.7,AV,NA,AV,SVD,AV,AV,NA,NA,NA,SVD,SVD,AV,AV,AV,NRAL,Results,Principal Investigator,,"1: Metadata has been QCd by BF2: QC flags and detection limits added by MK.3: Results QC'ed by KS.4: Visual observation: driest creeks have been all season/extremly low flow"
,3764,1,9/16/2013,CALVERT,HAKAI,FGS,1,819 OUTLET,114,NUT4593,F,51.657375,-128.042222,,,,0,,0.45nm,13,,2013-09-16T21:00:31.000Z,2013-09-16T07:00:00.000Z,2013-11-25T08:00:00.000Z,,3.7,,,,2.4,4.6,285,262.4,,,,2.9,61.7,,28.5,1.5,AV,NA,AV,SVD,AV,AV,NA,NA,NA,AV,SVD,BDL,AV,AV,NRAL,Results,Principal Investigator,,"1: Metadata has been QCd by BF2: QC flags and detection limits added by MK.3: Results QC'ed by KS.4: Visual observation: driest creeks have been all season/extremly low flow"
,3765,1,9/16/2013,CALVERT,HAKAI,FGS,1,1015 OUTLET,115,NUT4594,F,51.690527,-128.067788,,,,0,,0.45nm,13,,2013-09-16T21:58:29.000Z,2013-09-16T07:00:00.000Z,2013-11-25T08:00:00.000Z,,0.9,,,,4.7,4.5,239.2,218.1,,,,,81.1,,9.4,1.4,AV,NA,AV,AV,AV,AV,NA,NA,NA,BDL,SVD,BDL,AV,AV,NRAL,Results,Principal Investigator,,"1: Metadata has been QCd by BF2: QC flags and detection limits added by MK.3: Results QC'ed by KS.4: Visual observation: driest creeks have been all season/extremly low flow"
,3766,2,9/30/2013,CALVERT,HAKAI,FGS,1,819 OUTLET,54,NUT4595,F,51.657375,-128.042222,,,,0,,0.45nm,13,,2013-09-30T15:53:08.000Z,2013-09-30T07:00:00.000Z,2013-11-25T08:00:00.000Z,,3.7,,,,5.3,4.5,295.2,356.2,,,,1.4,8.4,2.6,10.5,2.5,AV,NA,AV,AV,AV,SVD,NA,NA,NA,AV,AV,AV,AV,AV,NRAL,Results,Principal Investigator,,"1: Metadata has been QCd by BF2: NA3: QC flags and detection limits added by MK.4: Results QC'ed by KS."
,3766,3,9/30/2013,CALVERT,HAKAI,FGS,1,819 OUTLET,89,NUT4596,F,51.657375,-128.042222,,,,0,,0.45nm,13,,2013-09-30T16:10:32.000Z,2013-09-30T07:00:00.000Z,2013-11-25T08:00:00.000Z,,4.7,,,,7.4,3.8,329.2,303.8,,,,2.2,9.9,,10.9,6.4,AV,NA,AV,AV,AV,AV,NA,NA,NA,AV,AV,BDL,AV,AV,NRAL,Results,Principal Investigator,,"1: Metadata has been QCd by BF2: NA3: QC flags and detection limits added by MK.4: Results QC'ed by KS."
,3766,1,9/30/2013,CALVERT,HAKAI,FGS,1,819 OUTLET,45,NUT4597,F,51.657375,-128.042222,,,,0,,0.45nm,13,,2013-09-30T16:23:52.000Z,2013-09-30T07:00:00.000Z,2013-11-25T08:00:00.000Z,,6.7,,,,3.2,5.1,312.5,358.8,,,,1.7,7.7,1.6,9.2,2.8,AV,NA,AV,SVD,AV,AV,NA,NA,NA,AV,AV,AV,AV,AV,NRAL,Results,Principal Investigator,,"1: Metadata has been QCd by BF2: NA3: QC flags and detection limits added by MK.4: Results QC'ed by KS."
,3769,1,9/30/2013,CALVERT,HAKAI,FGS,1,844 OUTLET,103,NUT4598,F,51.658183,-128.002068,,,,0,,0.45nm,13,,2013-09-30T16:24:58.000Z,2013-09-30T07:00:00.000Z,2013-11-25T08:00:00.000Z,,2.8,,,,3.5,2.6,291.3,237,,,,1.7,8.7,,10.6,3.4,AV,NA,AV,AV,AV,AV,NA,NA,NA,AV,AV,BDL,AV,AV,NRAL,Results,Principal Investigator,,"1: Metadata has been QCd by BF2: NA3: QC flags and detection limits added by MK.4: Results QC'ed by KS."
,3770,1,9/30/2013,CALVERT,HAKAI,FGS,1,693 OUTLET,51,NUT4599,F,51.647923,-127.996399,,,,0,,0.45nm,13,,2013-09-30T17:06:46.000Z,2013-09-30T07:00:00.000Z,2013-11-25T08:00:00.000Z,,4.7,,,,6.1,3.3,220,268,,,,1.4,9.2,2.6,9.5,2,AV,NA,AV,AV,AV,SVD,NA,NA,NA,AV,AV,AV,AV,AV,NRAL,Results,Principal Investigator,,"1: Metadata has been QCd by BF2: NA3: QC flags and detection limits added by MK.4: Results QC'ed by KS."
,3771,1,9/30/2013,CALVERT,HAKAI,FGS,1,703 OUTLET,116,NUT4600,F,51.64853,-128.026062,,,,0,,0.45nm,13,,2013-09-30T17:50:01.000Z,2013-09-30T07:00:00.000Z,2013-11-25T08:00:00.000Z,,4.1,,,,5.3,3.8,315.1,215.1,,,,1.4,3.4,2.3,10.6,3,AV,NA,AV,AV,SVC,AV,NA,NA,NA,AV,AV,AV,AV,AV,NRAL,Results,Principal Investigator,,"1: Metadata has been QCd by BF2: NA3: QC flags and detection limits added by MK.4: Results QC'ed by KS."
,3772,1,9/30/2013,CALVERT,HAKAI,FGS,1,708 OUTLET,47,NUT4601,F,51.649199,-128.068516,,,,0,,0.45nm,13,,2013-09-30T18:42:52.000Z,2013-09-30T07:00:00.000Z,2013-11-25T08:00:00.000Z,,2.2,,,,4.9,5,255.5,280.5,,,,1.4,9.3,2.9,16.7,2.3,AV,NA,AV,AV,AV,AV,NA,NA,NA,AV,AV,AV,AV,AV,NRAL,Results,Principal Investigator,,"1: Metadata has been QCd by BF2: NA3: QC flags and detection limits added by MK.4: Results QC'ed by KS."
,3773,1,9/30/2013,CALVERT,HAKAI,FGS,1,626 OUTLET,98,NUT4602,F,51.641718,-128.120582,,,,0,,0.45nm,13,,2013-09-30T19:25:03.000Z,2013-09-30T07:00:00.000Z,2013-11-25T08:00:00.000Z,,1.7,,,,6.2,2.9,342.3,286.9,,,,1.6,7.7,,10,3.5,AV,NA,AV,AV,AV,AV,NA,NA,NA,AV,AV,BDL,AV,AV,NRAL,Results,Principal Investigator,,"1: Metadata has been QCd by BF2: NA3: QC flags and detection limits added by MK.4: Results QC'ed by KS."
,3774,1,9/30/2013,CALVERT,HAKAI,FGS,1,1015 OUTLET,63,NUT4603,F,51.690527,-128.067788,,,,0,,0.45nm,13,,2013-09-30T20:11:07.000Z,2013-09-30T07:00:00.000Z,2013-11-25T08:00:00.000Z,,1.6,,,,4.7,4.2,250.2,248.9,,,,,10.5,2.7,11.6,1.9,AV,NA,AV,AV,AV,AV,NA,NA,NA,BDL,AV,AV,AV,AV,NRAL,Results,Principal Investigator,,"1: Metadata has been QCd by BF2: NA3: QC flags and detection limits added by MK.4: Results QC'ed by KS."
,3775,1,10/16/2013,CALVERT,HAKAI,FGS,1,1015 OUTLET,121,NUT4604,F,51.690527,-128.067788,,,,0,,0.45nm,13,,2013-10-16T16:34:22.000Z,2013-10-16T07:00:00.000Z,2013-11-25T08:00:00.000Z,,7.2,,,,7.4,7.7,228,223.6,,,,2.3,7.7,1.9,12,4.1,AV,NA,AV,AV,AV,AV,NA,NA,NA,SVD,AV,AV,AV,AV,NRAL,Results,Principal Investigator,,"1: Metadata has been QCd by BF2: QC flags and detection limits added by MK.3: Replacement filters had tinfoil stuck to them4: Results QC'ed by KS."
,3776,3,10/16/2013,CALVERT,HAKAI,FGS,1,819 OUTLET,126,NUT4605,F,51.657375,-128.042222,,,,0,,0.45nm,13,,2013-10-16T17:29:54.000Z,2013-10-16T07:00:00.000Z,2013-11-25T08:00:00.000Z,,4.4,,,,11,19.5,318,346.3,,,,2.6,10.2,2.4,10.9,1.6,AV,NA,AV,SVD,AV,AV,NA,NA,NA,AV,AV,AV,AV,AV,NRAL,Results,Principal Investigator,,"1: Metadata has been QCd by BF2: QC flags and detection limits added by MK.3: Replacement filters had tinfoil stuck to them4: Results QC'ed by KS."
,3776,2,10/16/2013,CALVERT,HAKAI,FGS,1,819 OUTLET,125,NUT4606,F,51.657375,-128.042222,,,,0,,0.45nm,13,,2013-10-16T17:53:07.000Z,2013-10-16T07:00:00.000Z,2013-11-25T08:00:00.000Z,,2.7,,,,13.4,13.7,294.6,1602.2,,,,2.1,6.6,2.5,10.5,19.2,AV,NA,AV,AV,AV,SVD,NA,NA,NA,AV,AV,AV,AV,SVC,NRAL,Results,Principal Investigator,,"1: Metadata has been QCd by BF2: QC flags and detection limits added by MK.3: Replacement filters had tinfoil stuck to them4: Results QC'ed by KS."
,3776,1,10/16/2013,CALVERT,HAKAI,FGS,1,819 OUTLET,123,NUT4607,F,51.657375,-128.042222,,,,0,,0.45nm,13,,2013-10-16T18:20:44.000Z,2013-10-16T07:00:00.000Z,2013-11-25T08:00:00.000Z,,3.8,,,,11.7,8.7,286.4,287.7,,,,2.4,6,3.2,14.3,3.3,AV,NA,AV,AV,AV,AV,NA,NA,NA,AV,AV,AV,AV,AV,NRAL,Results,Principal Investigator,,"1: Metadata has been QCd by BF2: QC flags and detection limits added by MK.3: Replacement filters had tinfoil stuck to them4: Results QC'ed by KS."
,3779,1,10/16/2013,CALVERT,HAKAI,FGS,1,844 OUTLET,127,NUT4608,F,51.658183,-128.002068,,,,0,,0.45nm,13,,2013-10-16T19:07:22.000Z,2013-10-16T07:00:00.000Z,2013-11-25T08:00:00.000Z,,8.1,,,,19.4,11.5,447,292.6,,,,2.3,8.5,3.4,5.1,14.4,AV,NA,AV,AV,SVC,SVC,NA,NA,NA,AV,AV,AV,AV,SVC,NRAL,Results,Principal Investigator,,"1: Metadata has been QCd by BF2: QC flags and detection limits added by MK.3: Replacement filters had tinfoil stuck to them4: Results QC'ed by KS."
,3780,1,10/16/2013,CALVERT,HAKAI,FGS,1,626 OUTLET,129,NUT4609,F,51.641718,-128.120582,,,,0,,0.45nm,13,,2013-10-16T20:19:09.000Z,2013-10-16T07:00:00.000Z,2013-11-25T08:00:00.000Z,,42.7,,,,18,27.2,376.1,333.5,,,,16.7,7.2,4.6,21.6,9.8,SVC,NA,AV,SVD,AV,AV,NA,NA,NA,SVD,AV,AV,AV,AV,NRAL,Results,Principal Investigator,,"1: Metadata has been QCd by BF2: QC flags and detection limits added by MK.3: Replacement filters had tinfoil stuck to them4: Results QC'ed by KS."
,3781,1,10/16/2013,CALVERT,HAKAI,FGS,1,708 OUTLET,128,NUT4610,F,51.649199,-128.068516,,,,0,,0.45nm,13,,2013-10-16T21:47:38.000Z,2013-10-16T07:00:00.000Z,2013-11-25T08:00:00.000Z,,87.7,,,,15.4,13.5,260.5,254.8,,,,2.1,7.4,3.1,6.6,9.6,SVD,NA,AV,AV,AV,AV,NA,NA,NA,AV,AV,AV,AV,AV,NRAL,Results,Principal Investigator,,"1: Metadata has been QCd by BF2: QC flags and detection limits added by MK.3: Replacement filters had tinfoil stuck to them4: Results QC'ed by KS."
,3782,1,10/16/2013,CALVERT,HAKAI,FGS,1,703 OUTLET,122,NUT4611,F,51.64853,-128.026062,,,,0,,0.45nm,13,,2013-10-16T22:31:27.000Z,2013-10-16T07:00:00.000Z,2013-11-25T08:00:00.000Z,,3.7,,,,17.1,14.1,230.5,158.2,,,,2.8,5.4,5.7,36.6,13.5,AV,NA,AV,AV,AV,AV,NA,NA,NA,AV,AV,AV,AV,SVC,NRAL,Results,Principal Investigator,,"1: Metadata has been QCd by BF2: QC flags and detection limits added by MK.3: Replacement filters had tinfoil stuck to them4: Results QC'ed by KS."
,3783,1,10/16/2013,CALVERT,HAKAI,FGS,1,693 OUTLET,124,NUT4612,F,51.647923,-127.996399,,,,0,,0.45nm,13,,2013-10-16T23:23:39.000Z,2013-10-16T07:00:00.000Z,2013-11-25T08:00:00.000Z,,4.8,,,,16.7,15,264.4,259.1,,,,2.3,6.4,3.7,5.5,3.2,AV,NA,AV,AV,AV,AV,NA,NA,NA,AV,SVD,AV,AV,AV,NRAL,Results,Principal Investigator,,"1: Metadata has been QCd by BF2: QC flags and detection limits added by MK.3: Replacement filters had tinfoil stuck to them4: Results QC'ed by KS."
,3784,1,11/6/2013,CALVERT,HAKAI,FGS,1,1015 OUTLET,131,NUT4613,F,51.690527,-128.067788,,,,0,,0.45nm,13,,2013-11-06T16:42:28.000Z,2013-11-06T08:00:00.000Z,2013-11-25T08:00:00.000Z,,9.7,,,,9.9,18.2,289.9,277.9,,,,,9.4,1.7,5.7,3.2,AV,NA,AV,SVD,AV,AV,NA,NA,NA,BDL,AV,AV,AV,AV,NRAL,Results,Principal Investigator,,"1: Metadata has been QCd by BF2: NA3: QC flags and detection limits added by MK.4: Results QC'ed by KS."
,3785,1,11/6/2013,CALVERT,HAKAI,FGS,1,819 OUTLET,132,NUT4614,F,51.657375,-128.042222,,,,0,,0.45nm,13,,2013-11-06T18:53:43.000Z,2013-11-06T08:00:00.000Z,2013-11-25T08:00:00.000Z,,4.1,,,,6.5,14.4,236.5,239.1,,,,1.4,9.2,1,8.6,2.7,AV,NA,AV,SVD,AV,AV,NA,NA,NA,SVD,AV,AV,AV,AV,NRAL,Results,Principal Investigator,,"1: Metadata has been QCd by BF2: NA3: QC flags and detection limits added by MK.4: Results QC'ed by KS."
,3786,1,11/6/2013,CALVERT,HAKAI,FGS,1,844 OUTLET,133,NUT4615,F,51.658183,-128.002068,,,,0,,0.45nm,13,,2013-11-06T19:17:24.000Z,2013-11-06T08:00:00.000Z,2013-11-25T08:00:00.000Z,,4,,,,6.7,21,230.3,272.5,,,,,10,,7.6,4.3,AV,NA,AV,SVD,AV,SVD,NA,NA,NA,BDL,SVD,BDL,AV,AV,NRAL,Results,Principal Investigator,,"1: Metadata has been QCd by BF2: NA3: QC flags and detection limits added by MK.4: Results QC'ed by KS."
,3787,1,11/6/2013,CALVERT,HAKAI,FGS,1,693 OUTLET,134,NUT4616,F,51.647923,-127.996399,,,,0,,0.45nm,13,,2013-11-06T20:49:26.000Z,2013-11-06T08:00:00.000Z,2013-11-25T08:00:00.000Z,,1.9,,,,6.8,15.3,237.4,251.2,,,,1.1,10,1,8.4,3.5,AV,NA,AV,SVD,AV,AV,NA,NA,NA,AV,SVD,AV,AV,AV,NRAL,Results,Principal Investigator,,"1: Metadata has been QCd by BF2: NA3: QC flags and detection limits added by MK.4: Results QC'ed by KS."
,3788,1,11/6/2013,CALVERT,HAKAI,FGS,1,703 OUTLET,135,NUT4617,F,51.64853,-128.026062,,,,0,,0.45nm,13,,2013-11-06T22:12:04.000Z,2013-11-06T08:00:00.000Z,2013-11-25T08:00:00.000Z,,4.1,,,,8.5,12.5,186.3,180.1,,,,,9.2,1.1,6.8,3.5,AV,NA,AV,SVD,AV,AV,NA,NA,NA,BDL,SVD,AV,AV,AV,NRAL,Results,Principal Investigator,,"1: Metadata has been QCd by BF2: NA3: QC flags and detection limits added by MK.4: Results QC'ed by KS."
,3788,2,11/6/2013,CALVERT,HAKAI,FGS,1,703 OUTLET,136,NUT4618,F,51.64853,-128.026062,,,,0,,0.45nm,13,,2013-11-06T22:35:36.000Z,2013-11-06T08:00:00.000Z,2013-11-25T08:00:00.000Z,,2.4,,,,9.4,10.3,195.6,182.1,,,,1.5,8.4,1.9,7.5,5.4,AV,NA,AV,AV,AV,AV,NA,NA,NA,AV,AV,AV,AV,AV,NRAL,Results,Principal Investigator,,"1: Metadata has been QCd by BF2: NA3: QC flags and detection limits added by MK.4: Results QC'ed by KS."
,3788,3,11/6/2013,CALVERT,HAKAI,FGS,1,703 OUTLET,137,NUT4619,F,51.64853,-128.026062,,,,0,,0.45nm,13,,2013-11-06T22:51:04.000Z,2013-11-06T08:00:00.000Z,2013-11-25T08:00:00.000Z,,3.9,,,,8.4,19.1,157.8,283.7,,,,1.6,8.2,2,7.7,3.8,AV,NA,AV,SVD,AV,SVD,NA,NA,NA,AV,AV,AV,AV,AV,NRAL,Results,Principal Investigator,,"1: Metadata has been QCd by BF2: NA3: QC flags and detection limits added by MK.4: Results QC'ed by KS."
,3791,1,11/6/2013,CALVERT,HAKAI,FGS,1,708 OUTLET,138,NUT4620,F,51.649199,-128.068516,,,,0,,0.45nm,13,,2013-11-06T23:47:11.000Z,2013-11-06T08:00:00.000Z,2013-11-25T08:00:00.000Z,,7.7,,,,13.4,19.5,304.4,406.9,,,,1.8,5.8,2.2,11.2,8.3,AV,NA,AV,SVD,AV,SVD,NA,NA,NA,AV,AV,AV,AV,AV,NRAL,Results,Principal Investigator,,"1: Metadata has been QCd by BF2: NA3: QC flags and detection limits added by MK.4: Results QC'ed by KS."
,3792,1,11/6/2013,CALVERT,HAKAI,FGS,1,626 OUTLET,139,NUT4621,F,51.641718,-128.120582,,,,0,,0.45nm,13,,2013-11-07T00:51:34.000Z,2013-11-06T08:00:00.000Z,2013-11-25T08:00:00.000Z,,2.2,,,,21.7,23.7,342.3,403.9,,,,3.2,9.5,3.3,10.2,1.8,AV,NA,AV,SVC,AV,SVD,NA,NA,NA,AV,AV,AV,AV,AV,NRAL,Results,Principal Investigator,,"1: Metadata has been QCd by BF2: NA3: QC flags and detection limits added by MK.4: Results QC'ed by KS."
,3793,1,11/27/2013,CALVERT,HAKAI,FGS,1,626 OUTLET,140,NUT4622,F,51.641718,-128.120582,,,,0,,0.45nm,13,,2013-11-27T16:34:01.000Z,2013-11-27T08:00:00.000Z,2014-02-20T08:00:00.000Z,,0.9,,,,8.2,8.2,238.4,225.1,,,,3.4,,5,,1.7,AV,NA,AV,AV,AV,AV,NA,NA,NA,AV,BDL,AV,BDL,AV,NRAL,Results,Principal Investigator,,"1: Metadata has been QCd by BF2: NA3: QC flags and detection limits added by MK.4: Results QC'ed by KS."
,3794,1,11/27/2013,CALVERT,HAKAI,FGS,1,708 OUTLET,141,NUT4623,F,51.649199,-128.068516,,,,0,,0.45nm,13,,2013-11-27T17:21:33.000Z,2013-11-27T08:00:00.000Z,2014-02-20T08:00:00.000Z,,10.2,,,,9.3,6.1,244.6,236.7,,,,2.4,,3.5,7.1,12.5,AV,NA,AV,AV,AV,AV,NA,NA,NA,AV,BDL,AV,AV,AV,NRAL,Results,Principal Investigator,,"1: Metadata has been QCd by BF2: NA3: QC flags and detection limits added by MK.4: Results QC'ed by KS."
,3795,1,11/27/2013,CALVERT,HAKAI,FGS,1,703 OUTLET,142,NUT4624,F,51.64853,-128.026062,,,,0,,0.45nm,13,,2013-11-27T18:09:08.000Z,2013-11-27T08:00:00.000Z,2014-02-20T08:00:00.000Z,,6.1,,,,5.4,9.7,114.9,114.8,,,,1.3,,2.4,,1.5,AV,NA,AV,SVD,AV,AV,NA,NA,NA,AV,BDL,AV,BDL,AV,NRAL,Results,Principal Investigator,,"1: Metadata has been QCd by BF2: NA3: QC flags and detection limits added by MK.4: Results QC'ed by KS."
,3796,1,11/27/2013,CALVERT,HAKAI,FGS,1,693 OUTLET,143,NUT4625,F,51.647923,-127.996399,,,,0,,0.45nm,13,,2013-11-27T19:08:32.000Z,2013-11-27T08:00:00.000Z,2014-02-20T08:00:00.000Z,,3.5,,,,9.9,6.5,232.8,202.5,,,,2.7,,2.4,,5,AV,NA,AV,AV,AV,AV,NA,NA,NA,AV,BDL,AV,BDL,AV,NRAL,Results,Principal Investigator,,"1: Metadata has been QCd by BF2: NA3: QC flags and detection limits added by MK.4: Results QC'ed by KS."
,3797,1,11/27/2013,CALVERT,HAKAI,FGS,1,844 OUTLET,144,NUT4626,F,51.658183,-128.002068,,,,0,,0.45nm,13,,2013-11-27T20:17:50.000Z,2013-11-27T08:00:00.000Z,2014-02-20T08:00:00.000Z,,5.1,,,,7.6,3.8,217.1,215.8,,,,2.2,,1.1,,1.9,AV,NA,AV,AV,AV,AV,NA,NA,NA,SVD,BDL,AV,BDL,AV,NRAL,Results,Principal Investigator,,"1: Metadata has been QCd by BF2: NA3: QC flags and detection limits added by MK.4: Results QC'ed by KS."
,3798,1,11/27/2013,CALVERT,HAKAI,FGS,1,819 OUTLET,145,NUT4627,F,51.657375,-128.042222,,,,0,,0.45nm,13,,2013-11-27T21:03:51.000Z,2013-11-27T08:00:00.000Z,2014-02-20T08:00:00.000Z,,0.9,,,,15,5,240.8,211.8,,,,3.2,,1.1,,1.6,AV,NA,AV,AV,AV,AV,NA,NA,NA,SVD,BDL,AV,BDL,AV,NRAL,Results,Principal Investigator,,"1: Metadata has been QCd by BF2: NA3: QC flags and detection limits added by MK.4: Results QC'ed by KS."
,3799,2,11/27/2013,CALVERT,HAKAI,FGS,1,1015 OUTLET,147,NUT4628,F,51.690527,-128.067788,,,,0,,0.45nm,13,,2013-11-27T22:14:37.000Z,2013-11-27T08:00:00.000Z,2014-02-20T08:00:00.000Z,,4.4,,,,25.7,6.4,341.3,248.5,,,,1.7,,2,10,3.5,AV,NA,AV,AV,AV,AV,NA,NA,NA,AV,BDL,AV,AV,AV,NRAL,Results,Principal Investigator,,"1: Metadata has been QCd by BF2: NA3: QC flags and detection limits added by MK.4: Results QC'ed by KS."
,3799,3,11/27/2013,CALVERT,HAKAI,FGS,1,1015 OUTLET,148,NUT4629,F,51.690527,-128.067788,,,,0,,0.45nm,13,,2013-11-27T22:21:51.000Z,2013-11-27T08:00:00.000Z,2014-02-20T08:00:00.000Z,,4.3,,,,13.5,8.5,258.5,240.5,,,,3.3,,3.8,,2.3,AV,NA,AV,AV,AV,AV,NA,NA,NA,AV,BDL,AV,BDL,AV,NRAL,Results,Principal Investigator,,"1: Metadata has been QCd by BF2: NA3: QC flags and detection limits added by MK.4: Results QC'ed by KS."
,3799,1,11/27/2013,CALVERT,HAKAI,FGS,1,1015 OUTLET,146,NUT4630,F,51.690527,-128.067788,,,,0,,0.45nm,13,,2013-11-27T22:38:39.000Z,2013-11-27T08:00:00.000Z,2014-02-20T08:00:00.000Z,,4.9,,,,7.3,4.4,239.9,232.3,,,,1.9,,,11.6,2.8,AV,NA,AV,AV,AV,AV,NA,NA,NA,AV,BDL,BDL,AV,AV,NRAL,Results,Principal Investigator,,"1: Metadata has been QCd by BF2: NA3: QC flags and detection limits added by MK.4: Results QC'ed by KS."
,84030,1,1/9/2014,CALVERT,HAKAI,FGS,1,1015 OUTLET,,CM001,F,51.690527,-128.067788,,,,0,,0.45nm,13,,2014-01-09T08:00:00.000Z,2014-01-09T08:00:00.000Z,,,,,,,,,,,,,,,,,,,,,,,,,,,,,,,,,,Not Available,Principal Investigator,,"1: Metadata has been QCd by BF | 1015 not visited; confirmed with CTD file2: QC flags and detection limits added by MK.3: Results QC'ed by KS."
,3802,1,1/9/2014,CALVERT,HAKAI,FGS,1,626 OUTLET,149,NUT4631,F,51.641718,-128.120582,,,,0,,0.45nm,13,,2014-01-09T17:06:41.000Z,2014-01-09T08:00:00.000Z,2014-02-20T08:00:00.000Z,,2.9,,,,12.5,35.2,222.3,309.1,,,,,,,,6.9,AV,NA,AV,SVD,AV,SVD,NA,NA,NA,BDL,BDL,BDL,BDL,AV,NRAL,Results,Principal Investigator,,"1: 708 YSI time is entered under site 7032: Metadata has been QCd by BF3: QC flags and detection limits added by MK.4: Results QC'ed by KS."
,3803,1,1/9/2014,CALVERT,HAKAI,FGS,1,708 OUTLET,150,NUT4632,F,51.649199,-128.068516,,,,0,,0.45nm,13,,2014-01-09T18:11:27.000Z,2014-01-09T08:00:00.000Z,2014-02-20T08:00:00.000Z,,8.1,,,,47.8,27.4,257.9,253.1,,,,1.4,,,5.5,9.2,AV,NA,SVC,SVC,AV,AV,NA,NA,NA,AV,BDL,BDL,AV,AV,NRAL,Results,Principal Investigator,,"1: 708 YSI time is entered under site 7032: Metadata has been QCd by BF3: QC flags and detection limits added by MK.4: Results QC'ed by KS."
,3803,2,1/9/2014,CALVERT,HAKAI,FGS,1,708 OUTLET,151,NUT4633,F,51.649199,-128.068516,,,,0,,0.45nm,13,,2014-01-09T18:40:23.000Z,2014-01-09T08:00:00.000Z,2014-02-20T08:00:00.000Z,,9.3,,,,15.2,12.1,238.7,228.8,,,,,,1.6,5.2,9,AV,NA,AV,AV,AV,AV,NA,NA,NA,BDL,BDL,AV,AV,AV,NRAL,Results,Principal Investigator,,"1: 708 YSI time is entered under site 7032: Metadata has been QCd by BF3: QC flags and detection limits added by MK.4: Results QC'ed by KS."
,3803,3,1/9/2014,CALVERT,HAKAI,FGS,1,708 OUTLET,152,NUT4634,F,51.649199,-128.068516,,,,0,,0.45nm,13,,2014-01-09T19:00:07.000Z,2014-01-09T08:00:00.000Z,2014-02-20T08:00:00.000Z,,10.1,,,,14.7,6.3,214.2,219.6,,,,,5.1,,5,9.6,AV,NA,AV,AV,AV,AV,NA,NA,NA,BDL,AV,BDL,AV,AV,NRAL,Results,Principal Investigator,,"1: 708 YSI time is entered under site 7032: Metadata has been QCd by BF3: QC flags and detection limits added by MK.4: Results QC'ed by KS."
,3806,1,1/9/2014,CALVERT,HAKAI,FGS,1,703 OUTLET,153,NUT4635,F,51.64853,-128.026062,,,,0,,0.45nm,13,,2014-01-09T20:01:56.000Z,2014-01-09T08:00:00.000Z,2014-02-20T08:00:00.000Z,,5.7,,,,5.2,27.6,146,220.4,,,,,,,,3.6,AV,NA,AV,SVD,AV,SVD,NA,NA,NA,BDL,BDL,BDL,BDL,AV,NRAL,Results,Principal Investigator,,"1: 708 YSI time is entered under site 7032: Metadata has been QCd by BF3: QC flags and detection limits added by MK.4: Results QC'ed by KS."
,3807,1,1/9/2014,CALVERT,HAKAI,FGS,1,693 OUTLET,154,NUT4636,F,51.647923,-127.996399,,,,0,,0.45nm,13,,2014-01-09T21:20:22.000Z,2014-01-09T08:00:00.000Z,2014-02-20T08:00:00.000Z,,5.4,,,,11.1,8.7,274.4,163.9,,,,,,1.2,6.7,6.2,AV,NA,AV,AV,AV,AV,NA,NA,NA,BDL,BDL,AV,AV,AV,NRAL,Results,Principal Investigator,,"1: 708 YSI time is entered under site 7032: Metadata has been QCd by BF3: QC flags and detection limits added by MK.4: Results QC'ed by KS."
,3808,1,1/9/2014,CALVERT,HAKAI,FGS,1,844 OUTLET,155,NUT4637,F,51.658183,-128.002068,,,,0,,0.45nm,13,,2014-01-09T22:26:07.000Z,2014-01-09T08:00:00.000Z,2014-02-20T08:00:00.000Z,,3.6,,,,4,20.9,216.8,242.3,,,,,,1.2,6.9,10.4,AV,NA,AV,SVD,AV,AV,NA,NA,NA,BDL,BDL,AV,AV,AV,NRAL,Results,Principal Investigator,,"1: 708 YSI time is entered under site 7032: Metadata has been QCd by BF3: QC flags and detection limits added by MK.4: Results QC'ed by KS."
,3809,1,1/9/2014,CALVERT,HAKAI,FGS,1,819 OUTLET,156,NUT4638,F,51.657375,-128.042222,,,,0,,0.45nm,13,,2014-01-09T23:43:18.000Z,2014-01-09T08:00:00.000Z,2014-02-20T08:00:00.000Z,,3.5,,,,5.6,6.1,218.6,206.2,,,,30.5,74.1,1.5,,3.4,AV,NA,AV,AV,AV,AV,NA,NA,NA,SVD,SVD,AV,BDL,AV,NRAL,Results,Principal Investigator,,"1: 708 YSI time is entered under site 7032: Metadata has been QCd by BF3: QC flags and detection limits added by MK.4: Results QC'ed by KS."
,3810,1,1/29/2014,CALVERT,HAKAI,FGS,1,693 OUTLET,157,NUT4639,F,51.647923,-127.996399,,,,0,,0.45nm,13,,2014-01-29T16:50:23.000Z,2014-01-29T08:00:00.000Z,2014-02-20T08:00:00.000Z,,7.8,,,,27.4,12.8,176,172.2,,,,3.6,12.3,3,5.1,7.7,AV,NA,AV,AV,AV,AV,NA,NA,NA,SVD,SVD,AV,AV,AV,NRAL,Results,Principal Investigator,,"1: Metadata has been QCd by BF2: NA3: QC flags and detection limits added by MK.4: Results QC'ed by KS."
,3811,1,1/29/2014,CALVERT,HAKAI,FGS,1,703 OUTLET,158,NUT4640,F,51.64853,-128.026062,,,,0,,0.45nm,13,,2014-01-29T17:36:27.000Z,2014-01-29T08:00:00.000Z,2014-02-20T08:00:00.000Z,,4.6,,,,18.9,5.7,177.2,139.7,,,,2.3,17.9,2.3,13.6,5.7,AV,NA,AV,AV,AV,AV,NA,NA,NA,AV,SVD,AV,AV,AV,NRAL,Results,Principal Investigator,,"1: Metadata has been QCd by BF2: NA3: QC flags and detection limits added by MK.4: Results QC'ed by KS."
,3812,1,1/29/2014,CALVERT,HAKAI,FGS,1,708 OUTLET,159,NUT4641,F,51.649199,-128.068516,,,,0,,0.45nm,13,,2014-01-29T18:21:46.000Z,2014-01-29T08:00:00.000Z,2014-02-20T08:00:00.000Z,,6.7,,,,8.9,7.9,206.9,197.1,,,,2.1,6.5,1,6.9,8.7,AV,NA,AV,AV,AV,AV,NA,NA,NA,SVD,AV,AV,AV,AV,NRAL,Results,Principal Investigator,,"1: Metadata has been QCd by BF2: NA3: QC flags and detection limits added by MK.4: Results QC'ed by KS."
,3812,2,1/29/2014,CALVERT,HAKAI,FGS,1,708 OUTLET,160,NUT4642,F,51.649199,-128.068516,,,,0,,0.45nm,13,,2014-01-29T18:40:17.000Z,2014-01-29T08:00:00.000Z,2014-02-20T08:00:00.000Z,,6.6,,,,9.4,3.5,227.1,172.6,,,,,5.9,,6.1,8.9,AV,NA,AV,AV,AV,AV,NA,NA,NA,BDL,AV,BDL,AV,AV,NRAL,Results,Principal Investigator,,"1: Metadata has been QCd by BF2: NA3: QC flags and detection limits added by MK.4: Results QC'ed by KS."
,3812,3,1/29/2014,CALVERT,HAKAI,FGS,1,708 OUTLET,161,NUT4643,F,51.649199,-128.068516,,,,0,,0.45nm,13,,2014-01-29T18:59:24.000Z,2014-01-29T08:00:00.000Z,2014-02-20T08:00:00.000Z,,6.8,,,,15.5,19,295.7,204,,,,,,1.6,6.4,6.4,AV,NA,AV,SVD,AV,AV,NA,NA,NA,BDL,BDL,AV,AV,AV,NRAL,Results,Principal Investigator,,"1: Metadata has been QCd by BF2: NA3: QC flags and detection limits added by MK.4: Results QC'ed by KS."
,3815,1,1/29/2014,CALVERT,HAKAI,FGS,1,626 OUTLET,162,NUT4644,F,51.641718,-128.120582,,,,0,,0.45nm,13,,2014-01-29T20:10:02.000Z,2014-01-29T08:00:00.000Z,2014-02-20T08:00:00.000Z,,3.9,,,,8.1,45.7,244,207.6,,,,1.1,,1.9,5.5,3.8,AV,NA,AV,SVD,AV,AV,NA,NA,NA,AV,BDL,AV,AV,AV,NRAL,Results,Principal Investigator,,"1: Metadata has been QCd by BF2: NA3: QC flags and detection limits added by MK.4: Results QC'ed by KS."
,3816,1,1/29/2014,CALVERT,HAKAI,FGS,1,844 OUTLET,163,NUT4645,F,51.658183,-128.002068,,,,0,,0.45nm,13,,2014-01-29T21:14:05.000Z,2014-01-29T08:00:00.000Z,2014-02-20T08:00:00.000Z,,3.1,,,,3.2,42.7,181.3,219.8,,,,1,,1.8,,2.9,AV,NA,AV,SVD,AV,SVD,NA,NA,NA,AV,BDL,AV,BDL,AV,NRAL,Results,Principal Investigator,,"1: Metadata has been QCd by BF2: NA3: QC flags and detection limits added by MK.4: Results QC'ed by KS."
,3817,1,1/29/2014,CALVERT,HAKAI,FGS,1,819 OUTLET,164,NUT4646,F,51.657375,-128.042222,,,,0,,0.45nm,13,,2014-01-29T21:55:13.000Z,2014-01-29T08:00:00.000Z,2014-02-20T08:00:00.000Z,,3.2,,,,7.7,23.6,184.3,180.1,,,,1.8,,1.4,,2.6,AV,NA,AV,SVD,AV,AV,NA,NA,NA,SVD,BDL,AV,BDL,AV,NRAL,Results,Principal Investigator,,"1: Metadata has been QCd by BF2: NA3: QC flags and detection limits added by MK.4: Results QC'ed by KS."
,3818,1,1/29/2014,CALVERT,HAKAI,FGS,1,1015 OUTLET,165,NUT4647,F,51.690527,-128.067788,,,,0,,0.45nm,13,,2014-01-29T22:41:16.000Z,2014-01-29T08:00:00.000Z,2014-02-20T08:00:00.000Z,,7,,,,5.6,6.2,231.1,230.1,,,,17.7,26.1,3,6.9,5.1,AV,NA,AV,AV,AV,AV,NA,NA,NA,SVD,SVD,AV,AV,AV,NRAL,Results,Principal Investigator,,"1: Metadata has been QCd by BF2: NA3: QC flags and detection limits added by MK.4: Results QC'ed by KS."
,3819,1,2/19/2014,CALVERT,HAKAI,FGS,1,1015 OUTLET,166,NUT4648,F,51.690527,-128.067788,,,,0,,0.45nm,13,,2014-02-19T17:27:07.000Z,2014-02-19T08:00:00.000Z,2014-07-24T07:00:00.000Z,,4.2,,,,26.8,10,239.6,212,,,,54.3,14.4,5.6,32,4.7,AV,NA,AV,AV,AV,AV,NA,NA,NA,SVD,AV,AV,SVC,AV,NRAL,Results,Principal Investigator,,"1: Metadata has been QCd by BF2: NA3: QC flags and detection limits added by MK.4: Results QC'ed by KS."
,3820,1,2/19/2014,CALVERT,HAKAI,FGS,1,819 OUTLET,167,NUT4649,F,51.657375,-128.042222,,,,0,,0.45nm,13,,2014-02-19T18:33:14.000Z,2014-02-19T08:00:00.000Z,2014-07-24T07:00:00.000Z,,3,,,,5.9,4.2,173.7,153.5,,,,7.7,7.2,5.8,32.3,3.4,AV,NA,AV,AV,AV,AV,NA,NA,NA,SVD,AV,AV,AV,AV,NRAL,Results,Principal Investigator,,"1: Metadata has been QCd by BF2: NA3: QC flags and detection limits added by MK.4: Results QC'ed by KS."
,3821,1,2/19/2014,CALVERT,HAKAI,FGS,1,844 OUTLET,168,NUT4650,F,51.658183,-128.002068,,,,0,,0.45nm,13,,2014-02-19T19:18:47.000Z,2014-02-19T08:00:00.000Z,2014-07-24T07:00:00.000Z,,2.6,,,,5.7,12.8,162.2,521.9,,,,5.2,15.7,5.2,29.1,1.4,AV,NA,AV,SVD,AV,SVD,NA,NA,NA,AV,AV,AV,AV,AV,NRAL,Results,Principal Investigator,,"1: Metadata has been QCd by BF2: NA3: QC flags and detection limits added by MK.4: Results QC'ed by KS."
,3822,1,2/19/2014,CALVERT,HAKAI,FGS,1,693 OUTLET,169,NUT4651,F,51.647923,-127.996399,,,,0,,0.45nm,13,,2014-02-19T20:07:16.000Z,2014-02-19T08:00:00.000Z,2014-07-24T07:00:00.000Z,,6,,,,14.8,6.9,211.4,183.5,,,,4.7,19.6,5.2,33,8,AV,NA,AV,AV,AV,AV,NA,NA,NA,AV,AV,AV,SVC,AV,NRAL,Results,Principal Investigator,,"1: Metadata has been QCd by BF2: NA3: QC flags and detection limits added by MK.4: Results QC'ed by KS."
,3823,1,2/19/2014,CALVERT,HAKAI,FGS,1,703 OUTLET,170,NUT4652,F,51.64853,-128.026062,,,,0,,0.45nm,13,,2014-02-19T21:19:37.000Z,2014-02-19T08:00:00.000Z,2014-07-24T07:00:00.000Z,,3.6,,,,8.6,18.4,124.6,324.1,,,,5.2,24,6,32,3.2,AV,NA,AV,SVD,AV,SVD,NA,NA,NA,SVC,SVC,AV,AV,AV,NRAL,Results,Principal Investigator,,"1: Metadata has been QCd by BF2: NA3: QC flags and detection limits added by MK.4: Results QC'ed by KS."
,3823,2,2/19/2014,CALVERT,HAKAI,FGS,1,703 OUTLET,171,NUT4653,F,51.64853,-128.026062,,,,0,,0.45nm,13,,2014-02-19T21:45:12.000Z,2014-02-19T08:00:00.000Z,2014-07-24T07:00:00.000Z,,4.2,,,,15.1,3.7,115.6,107.8,,,,4.8,25.5,5.6,31.1,3.9,AV,NA,AV,AV,AV,AV,NA,NA,NA,SVD,SVC,AV,AV,AV,NRAL,Results,Principal Investigator,,"1: Metadata has been QCd by BF2: NA3: QC flags and detection limits added by MK.4: Results QC'ed by KS."
,3823,3,2/19/2014,CALVERT,HAKAI,FGS,1,703 OUTLET,172,NUT4654,F,51.64853,-128.026062,,,,0,,0.45nm,13,,2014-02-19T22:08:53.000Z,2014-02-19T08:00:00.000Z,2014-07-24T07:00:00.000Z,,4.3,,,,14.2,5.4,350.4,109,,,,5,21.9,5.4,29.3,2.8,AV,NA,AV,AV,SVC,AV,NA,NA,NA,SVC,SVC,AV,AV,AV,NRAL,Results,Principal Investigator,,"1: Metadata has been QCd by BF2: NA3: QC flags and detection limits added by MK.4: Results QC'ed by KS."
,3826,1,2/19/2014,CALVERT,HAKAI,FGS,1,708 OUTLET,173,NUT4655,F,51.649199,-128.068516,,,,0,,0.45nm,13,,2014-02-19T22:56:10.000Z,2014-02-19T08:00:00.000Z,2014-07-24T07:00:00.000Z,,5.4,,,,11.1,20.5,228.8,313.8,,,,4.6,16.9,5.3,32.3,3.8,AV,NA,AV,SVD,AV,SVD,NA,NA,NA,AV,AV,AV,SVC,AV,NRAL,Results,Principal Investigator,,"1: Metadata has been QCd by BF2: NA3: QC flags and detection limits added by MK.4: Results QC'ed by KS."
,3827,1,2/19/2014,CALVERT,HAKAI,FGS,1,626 OUTLET,174,NUT4656,F,51.641718,-128.120582,,,,0,,0.45nm,13,,2014-02-19T23:46:24.000Z,2014-02-19T08:00:00.000Z,2014-07-24T07:00:00.000Z,,3.1,,,,7.5,7.8,189.6,185.8,,,,5.5,15.1,5.9,37,2.6,AV,NA,AV,AV,AV,AV,NA,NA,NA,AV,AV,AV,SVC,AV,NRAL,Results,Principal Investigator,,"1: Metadata has been QCd by BF2: NA3: QC flags and detection limits added by MK.4: Results QC'ed by KS."
,3828,1,3/18/2014,CALVERT,HAKAI,FGS,1,1015 OUTLET,175,NUT4657,F,51.690527,-128.067788,,,,0,,0.45nm,13,,2014-03-18T16:05:47.000Z,2014-03-18T07:00:00.000Z,2014-07-24T07:00:00.000Z,,7.2,,,,32.5,8.6,263,192.5,,,,8.2,33,5.9,18,7.9,AV,NA,AV,AV,AV,AV,NA,NA,NA,SVD,SVD,AV,SVC,AV,NRAL,Results,Principal Investigator,,"1: Metadata has been QCd by BF2: QC flags and detection limits added by MK.3: Results QC'ed by KS.4: YSI not adjusted for daylight savings; POMs screened in lab"
,3828,2,3/18/2014,CALVERT,HAKAI,FGS,1,1015 OUTLET,176,NUT4658,F,51.690527,-128.067788,,,,0,,0.45nm,13,,2014-03-18T16:21:19.000Z,2014-03-18T07:00:00.000Z,2014-07-24T07:00:00.000Z,,5.6,,,,9.7,8.6,237.9,183.4,,,,5.9,25.7,5.5,19.2,6.8,AV,NA,AV,AV,AV,AV,NA,NA,NA,AV,SVC,AV,SVC,AV,NRAL,Results,Principal Investigator,,"1: Metadata has been QCd by BF2: QC flags and detection limits added by MK.3: Results QC'ed by KS.4: YSI not adjusted for daylight savings; POMs screened in lab"
,3828,3,3/18/2014,CALVERT,HAKAI,FGS,1,1015 OUTLET,177,NUT4659,F,51.690527,-128.067788,,,,0,,0.45nm,13,,2014-03-18T16:44:08.000Z,2014-03-18T07:00:00.000Z,2014-07-24T07:00:00.000Z,,7.4,,,,8.4,6.4,188.6,203.2,,,,5.8,21.7,5.4,18.8,6,AV,NA,AV,AV,AV,AV,NA,NA,NA,AV,SVC,AV,SVC,AV,NRAL,Results,Principal Investigator,,"1: Metadata has been QCd by BF2: QC flags and detection limits added by MK.3: Results QC'ed by KS.4: YSI not adjusted for daylight savings; POMs screened in lab"
,3831,1,3/18/2014,CALVERT,HAKAI,FGS,1,819 OUTLET,178,NUT4660,F,51.657375,-128.042222,,,,0,,0.45nm,13,,2014-03-18T17:28:42.000Z,2014-03-18T07:00:00.000Z,2014-07-24T07:00:00.000Z,,3.2,,,,5.4,4,119.2,69.4,,,,5.7,19,5.2,20.8,2,AV,NA,AV,AV,AV,AV,NA,NA,NA,SVD,AV,AV,AV,AV,NRAL,Results,Principal Investigator,,"1: Metadata has been QCd by BF2: QC flags and detection limits added by MK.3: Results QC'ed by KS.4: YSI not adjusted for daylight savings; POMs screened in lab"
,3832,1,3/18/2014,CALVERT,HAKAI,FGS,1,844 OUTLET,179,NUT4661,F,51.658183,-128.002068,,,,0,,0.45nm,13,,2014-03-18T18:05:54.000Z,2014-03-18T07:00:00.000Z,2014-07-24T07:00:00.000Z,,2.6,,,,5.6,2.8,118.4,102.1,,,,5.5,11.7,5.1,18,2.2,AV,NA,AV,AV,AV,AV,NA,NA,NA,SVD,AV,AV,AV,AV,NRAL,Results,Principal Investigator,,"1: Metadata has been QCd by BF2: QC flags and detection limits added by MK.3: Results QC'ed by KS.4: YSI not adjusted for daylight savings; POMs screened in lab"
,3833,1,3/18/2014,CALVERT,HAKAI,FGS,1,693 OUTLET,180,NUT4662,F,51.647923,-127.996399,,,,0,,0.45nm,13,,2014-03-18T19:08:48.000Z,2014-03-18T07:00:00.000Z,2014-07-24T07:00:00.000Z,,5.2,,,,8.4,14.8,114.3,144.1,,,,5.7,16.2,5.1,22.6,4.1,AV,NA,AV,SVD,AV,SVD,NA,NA,NA,AV,AV,AV,AV,AV,NRAL,Results,Principal Investigator,,"1: Metadata has been QCd by BF2: QC flags and detection limits added by MK.3: Results QC'ed by KS.4: YSI not adjusted for daylight savings; POMs screened in lab"
,3834,1,3/18/2014,CALVERT,HAKAI,FGS,1,703 OUTLET,181,NUT4663,F,51.64853,-128.026062,,,,0,,0.45nm,13,,2014-03-18T19:52:22.000Z,2014-03-18T07:00:00.000Z,2014-07-24T07:00:00.000Z,,2.6,,,,17.9,5.9,153.2,90.7,,,,5.3,13.8,4.9,11.2,2.3,AV,NA,AV,AV,AV,AV,NA,NA,NA,SVC,SVD,AV,AV,AV,NRAL,Results,Principal Investigator,,"1: Metadata has been QCd by BF2: QC flags and detection limits added by MK.3: Results QC'ed by KS.4: YSI not adjusted for daylight savings; POMs screened in lab"
,3835,1,3/18/2014,CALVERT,HAKAI,FGS,1,708 OUTLET,182,NUT4664,F,51.649199,-128.068516,,,,0,,0.45nm,13,,2014-03-18T20:31:01.000Z,2014-03-18T07:00:00.000Z,2014-07-24T07:00:00.000Z,,4.8,,,,43.5,8.5,167.5,145.3,,,,4.9,5.7,5,25.9,3.6,AV,NA,SVC,AV,AV,AV,NA,NA,NA,AV,AV,AV,SVC,AV,NRAL,Results,Principal Investigator,,"1: Metadata has been QCd by BF2: QC flags and detection limits added by MK.3: Results QC'ed by KS.4: YSI not adjusted for daylight savings; POMs screened in lab"
,3836,1,3/18/2014,CALVERT,HAKAI,FGS,1,626 OUTLET,183,NUT4665,F,51.641718,-128.120582,,,,0,,0.45nm,13,,2014-03-18T21:21:53.000Z,2014-03-18T07:00:00.000Z,2014-07-24T07:00:00.000Z,,4.1,,,,11.9,8.3,178.9,179.3,,,,5.2,,5.7,22,2.9,AV,NA,AV,AV,AV,AV,NA,NA,NA,AV,BDL,AV,AV,AV,NRAL,Results,Principal Investigator,,"1: Metadata has been QCd by BF2: QC flags and detection limits added by MK.3: Results QC'ed by KS.4: YSI not adjusted for daylight savings; POMs screened in lab"
,3837,1,3/31/2014,CALVERT,HAKAI,FGS,1,819 OUTLET,184,NUT4666,F,51.657375,-128.042222,,,,0,,0.45nm,13,,2014-03-31T17:04:35.000Z,2014-03-31T07:00:00.000Z,2014-07-24T07:00:00.000Z,,4.1,,,,21,2.1,199.5,165.6,,,,15.3,22.7,25.5,26.5,5.4,AV,NA,AV,AV,AV,AV,NA,NA,NA,SVD,AV,SVD,AV,AV,NRAL,Results,Principal Investigator,,"1: Metadata has been QCd by BF2: QC flags and detection limits added by MK.3: Results QC'ed by KS.4: YSI time adjusted (but the calibration was done before the adjustment)"
,3838,1,3/31/2014,CALVERT,HAKAI,FGS,1,844 OUTLET,185,NUT4667,F,51.658183,-128.002068,,,,0,,0.45nm,13,,2014-03-31T17:57:55.000Z,2014-03-31T07:00:00.000Z,2014-07-24T07:00:00.000Z,,3.6,,,,12.1,2,254.7,153.8,,,,15.8,31.8,10.8,31.4,9,AV,NA,AV,AV,AV,AV,NA,NA,NA,SVD,AV,AV,AV,AV,NRAL,Results,Principal Investigator,,"1: Metadata has been QCd by BF2: QC flags and detection limits added by MK.3: Results QC'ed by KS.4: YSI time adjusted (but the calibration was done before the adjustment)"
,3839,1,3/31/2014,CALVERT,HAKAI,FGS,1,708 OUTLET,186,NUT4668,F,51.649199,-128.068516,,,,0,,0.45nm,13,,2014-03-31T18:55:52.000Z,2014-03-31T07:00:00.000Z,2014-07-24T07:00:00.000Z,,4.6,,,,18.1,8,283.9,184.8,,,,20,17.6,16,22.1,7.6,AV,NA,AV,AV,AV,AV,NA,NA,NA,SVD,AV,AV,SVC,AV,NRAL,Results,Principal Investigator,,"1: Metadata has been QCd by BF2: QC flags and detection limits added by MK.3: Results QC'ed by KS.4: YSI time adjusted (but the calibration was done before the adjustment)"
,3839,2,3/31/2014,CALVERT,HAKAI,FGS,1,708 OUTLET,187,NUT4669,F,51.649199,-128.068516,,,,0,,0.45nm,13,,2014-03-31T19:18:25.000Z,2014-03-31T07:00:00.000Z,2014-07-24T07:00:00.000Z,,5.5,,,,10.6,13.3,230.5,185.6,,,,17.4,125,25.8,21.9,5,AV,NA,AV,SVD,AV,AV,NA,NA,NA,SVD,SVD,SVD,SVC,AV,NRAL,Results,Principal Investigator,,"1: Metadata has been QCd by BF2: QC flags and detection limits added by MK.3: Results QC'ed by KS.4: YSI time adjusted (but the calibration was done before the adjustment)"
,3839,3,3/31/2014,CALVERT,HAKAI,FGS,1,708 OUTLET,188,NUT4670,F,51.649199,-128.068516,,,,0,,0.45nm,13,,2014-03-31T19:42:24.000Z,2014-03-31T07:00:00.000Z,2014-07-24T07:00:00.000Z,,6.3,,,,,39.2,209.6,178.6,,,,46.8,21.5,8.4,20.5,7.5,AV,NA,BDL,SVD,AV,AV,NA,NA,NA,SVD,AV,AV,AV,AV,NRAL,Results,Principal Investigator,,"1: Metadata has been QCd by BF2: QC flags and detection limits added by MK.3: Results QC'ed by KS.4: YSI time adjusted (but the calibration was done before the adjustment)"
,3842,1,3/31/2014,CALVERT,HAKAI,FGS,1,626 OUTLET,189,NUT4671,F,51.641718,-128.120582,,,,0,,0.45nm,13,,2014-03-31T20:35:01.000Z,2014-03-31T07:00:00.000Z,2014-07-24T07:00:00.000Z,,5.3,,,,2.9,14.9,213.7,215.2,,,,18,22,27.6,25.5,10,AV,NA,AV,SVD,AV,AV,NA,NA,NA,SVD,AV,SVD,AV,AV,NRAL,Results,Principal Investigator,,"1: Metadata has been QCd by BF2: QC flags and detection limits added by MK.3: Results QC'ed by KS.4: YSI time adjusted (but the calibration was done before the adjustment)"
,3843,1,3/31/2014,CALVERT,HAKAI,FGS,1,1015 OUTLET,190,NUT4672,F,51.690527,-128.067788,,,,0,,0.45nm,13,,2014-03-31T22:15:01.000Z,2014-03-31T07:00:00.000Z,2014-07-24T07:00:00.000Z,,9.1,,,,23.4,11.8,283.6,193.6,,,,30.2,19,56.1,24.3,10.8,AV,NA,AV,AV,AV,AV,NA,NA,NA,SVD,AV,SVD,SVC,AV,NRAL,Results,Principal Investigator,,"1: Metadata has been QCd by BF2: QC flags and detection limits added by MK.3: Results QC'ed by KS.4: YSI time adjusted (but the calibration was done before the adjustment)"
,3844,1,3/31/2014,CALVERT,HAKAI,FGS,1,703 OUTLET,191,NUT4673,F,51.64853,-128.026062,,,,0,,0.45nm,13,,2014-03-31T23:05:25.000Z,2014-03-31T07:00:00.000Z,2014-07-24T07:00:00.000Z,,5.5,,,,,14.3,93.5,132.2,,,,17,22,5.9,22.5,5.8,AV,NA,BDL,AV,AV,SVD,NA,NA,NA,SVD,AV,AV,AV,AV,NRAL,Results,Principal Investigator,,"1: Metadata has been QCd by BF2: QC flags and detection limits added by MK.3: Results QC'ed by KS.4: YSI time adjusted (but the calibration was done before the adjustment)"
,3845,1,3/31/2014,CALVERT,HAKAI,FGS,1,693 OUTLET,192,NUT4674,F,51.647923,-127.996399,,,,0,,0.45nm,13,,2014-03-31T23:49:38.000Z,2014-03-31T07:00:00.000Z,2014-07-24T07:00:00.000Z,,5.6,,,,15.6,47.6,194.7,141.4,,,,49.6,23.9,12.4,26.9,6.7,AV,NA,AV,SVD,AV,AV,NA,NA,NA,SVD,AV,SVC,AV,AV,NRAL,Results,Principal Investigator,,"1: Metadata has been QCd by BF2: QC flags and detection limits added by MK.3: Results QC'ed by KS.4: YSI time adjusted (but the calibration was done before the adjustment)"
,3846,1,4/6/2014,CALVERT,HAKAI,FGS,1,1015 OUTLET,193,NUT4675,F,51.690527,-128.067788,,,,0,,0.45nm,13,,2014-04-06T16:29:45.000Z,2014-04-06T07:00:00.000Z,2014-07-24T07:00:00.000Z,,16.2,,,,31.5,11,318.9,264.6,,,,13.2,27.3,21.9,19.2,8,AV,NA,AV,AV,AV,AV,NA,NA,NA,SVD,SVD,SVC,SVC,AV,NRAL,Results,Principal Investigator,,"1: Metadata has been QCd by BF2: NA3: QC flags and detection limits added by MK.4: Results QC'ed by KS."
,3847,1,4/6/2014,CALVERT,HAKAI,FGS,1,819 OUTLET,194,NUT4676,F,51.657375,-128.042222,,,,0,,0.45nm,13,,2014-04-06T17:19:55.000Z,2014-04-06T07:00:00.000Z,2014-07-24T07:00:00.000Z,,7.4,,,,11.4,6.6,196.5,258.3,,,,17.2,25,15.6,21,4.4,AV,NA,AV,AV,AV,SVD,NA,NA,NA,SVD,SVD,SVD,AV,AV,NRAL,Results,Principal Investigator,,"1: Metadata has been QCd by BF2: NA3: QC flags and detection limits added by MK.4: Results QC'ed by KS."
,3848,1,4/6/2014,CALVERT,HAKAI,FGS,1,844 OUTLET,195,NUT4677,F,51.658183,-128.002068,,,,0,,0.45nm,13,,2014-04-06T18:02:00.000Z,2014-04-06T07:00:00.000Z,2014-07-24T07:00:00.000Z,,6.2,,,,12.8,37.7,186.3,211.9,,,,48.5,20.7,11.3,19.6,4.4,AV,NA,AV,SVD,AV,AV,NA,NA,NA,SVD,AV,AV,AV,AV,NRAL,Results,Principal Investigator,,"1: Metadata has been QCd by BF2: NA3: QC flags and detection limits added by MK.4: Results QC'ed by KS."
,3849,1,4/6/2014,CALVERT,HAKAI,FGS,1,693 OUTLET,196,NUT4678,F,51.647923,-127.996399,,,,0,,0.45nm,13,,2014-04-06T18:35:54.000Z,2014-04-06T07:00:00.000Z,2014-07-24T07:00:00.000Z,,6.4,,,,26,32.8,196.4,177.4,,,,63.2,22.7,6.7,23,4.5,AV,NA,AV,SVD,AV,AV,NA,NA,NA,SVD,AV,AV,AV,AV,NRAL,Results,Principal Investigator,,"1: Metadata has been QCd by BF2: NA3: QC flags and detection limits added by MK.4: Results QC'ed by KS."
,3850,1,4/6/2014,CALVERT,HAKAI,FGS,1,703 OUTLET,197,NUT4679,F,51.64853,-128.026062,,,,0,,0.45nm,13,,2014-04-06T20:03:38.000Z,2014-04-06T07:00:00.000Z,2014-07-24T07:00:00.000Z,,1.1,,,,6.8,26,163.2,172.5,,,,25.1,33,3.8,22.7,2.1,AV,NA,AV,SVD,AV,AV,NA,NA,NA,SVD,SVD,AV,AV,AV,NRAL,Results,Principal Investigator,,"1: Metadata has been QCd by BF2: NA3: QC flags and detection limits added by MK.4: Results QC'ed by KS."
,3850,2,4/6/2014,CALVERT,HAKAI,FGS,1,703 OUTLET,198,NUT4680,F,51.64853,-128.026062,,,,0,,0.45nm,13,,2014-04-06T20:17:08.000Z,2014-04-06T07:00:00.000Z,2014-07-24T07:00:00.000Z,,6.2,,,,5.3,29.9,167.8,152.6,,,,10.4,30.5,6.2,23.7,2,AV,NA,AV,SVD,AV,AV,NA,NA,NA,SVD,SVD,SVD,AV,AV,NRAL,Results,Principal Investigator,,"1: Metadata has been QCd by BF2: NA3: QC flags and detection limits added by MK.4: Results QC'ed by KS."
,3850,3,4/6/2014,CALVERT,HAKAI,FGS,1,703 OUTLET,199,NUT4681,F,51.64853,-128.026062,,,,0,,0.45nm,13,,2014-04-06T20:30:11.000Z,2014-04-06T07:00:00.000Z,2014-07-24T07:00:00.000Z,,5,,,,,26,130.8,166.4,,,,3.7,24.9,11.8,26.5,5.2,AV,NA,BDL,SVC,AV,SVD,NA,NA,NA,AV,AV,AV,AV,AV,NRAL,Results,Principal Investigator,,"1: Metadata has been QCd by BF2: NA3: QC flags and detection limits added by MK.4: Results QC'ed by KS."
,3853,1,4/6/2014,CALVERT,HAKAI,FGS,1,708 OUTLET,200,NUT4682,F,51.649199,-128.068516,,,,0,,0.45nm,13,,2014-04-06T21:13:35.000Z,2014-04-06T07:00:00.000Z,2014-07-24T07:00:00.000Z,,8.4,,,,17.9,35.9,313.4,213.1,,,,19.6,23.2,16,24.7,5.1,AV,NA,AV,SVD,AV,AV,NA,NA,NA,SVD,AV,SVC,SVC,AV,NRAL,Results,Principal Investigator,,"1: Metadata has been QCd by BF2: NA3: QC flags and detection limits added by MK.4: Results QC'ed by KS."
,3854,1,4/6/2014,CALVERT,HAKAI,FGS,1,626 OUTLET,201,NUT4683,F,51.641718,-128.120582,,,,0,,0.45nm,13,,2014-04-06T21:58:42.000Z,2014-04-06T07:00:00.000Z,2014-07-24T07:00:00.000Z,,6.1,,,,12.1,24.2,221.6,238.9,,,,13.4,25.8,10.4,23.8,5.5,AV,NA,AV,SVD,AV,AV,NA,NA,NA,SVD,AV,AV,AV,AV,NRAL,Results,Principal Investigator,,"1: Metadata has been QCd by BF2: NA3: QC flags and detection limits added by MK.4: Results QC'ed by KS."
,3855,1,4/20/2014,CALVERT,HAKAI,FGS,1,1015 OUTLET,202,NUT4684,F,51.690527,-128.067788,,,,0,,0.45nm,13,,2014-04-20T16:34:37.000Z,2014-04-20T07:00:00.000Z,2014-07-24T07:00:00.000Z,,12.3,,,,20.4,16.2,222.4,218.3,,,,14.7,,9.6,12.4,8.8,AV,NA,AV,AV,AV,AV,NA,NA,NA,SVD,BDL,AV,AV,AV,NRAL,Results,Principal Investigator,,"1: Metadata has been QCd by BF2: NA3: QC flags and detection limits added by MK.4: Results QC'ed by KS."
,3856,2,4/20/2014,CALVERT,HAKAI,FGS,1,844 OUTLET,204,NUT4685,F,51.658183,-128.002068,,,,0,,0.45nm,13,,2014-04-20T17:25:13.000Z,2014-04-20T07:00:00.000Z,2014-07-24T07:00:00.000Z,,8.4,,,,24.5,320.7,320.7,315.6,,,,271.8,51.3,9,12.2,5.7,AV,NA,AV,SVD,AV,AV,NA,NA,NA,SVD,SVD,AV,AV,AV,NRAL,Results,Principal Investigator,,"1: Metadata has been QCd by BF2: NA3: QC flags and detection limits added by MK.4: Results QC'ed by KS."
,3856,3,4/20/2014,CALVERT,HAKAI,FGS,1,844 OUTLET,205,NUT4686,F,51.658183,-128.002068,,,,0,,0.45nm,13,,2014-04-20T17:43:52.000Z,2014-04-20T07:00:00.000Z,2014-07-24T07:00:00.000Z,,3.1,,,,20.1,66.5,258.2,265,,,,7.6,6,6.6,,5,AV,NA,AV,SVD,AV,AV,NA,NA,NA,SVD,AV,AV,BDL,AV,NRAL,Results,Principal Investigator,,"1: Metadata has been QCd by BF2: NA3: QC flags and detection limits added by MK.4: Results QC'ed by KS."
,3856,1,4/20/2014,CALVERT,HAKAI,FGS,1,844 OUTLET,203,NUT4687,F,51.658183,-128.002068,,,,0,,0.45nm,13,,2014-04-20T17:55:26.000Z,2014-04-20T07:00:00.000Z,2014-07-24T07:00:00.000Z,,8,,,,19,63,217.8,224.9,,,,23.4,13.4,18,17.4,8,AV,NA,AV,SVD,AV,AV,NA,NA,NA,SVD,AV,AV,AV,AV,NRAL,Results,Principal Investigator,,"1: Metadata has been QCd by BF2: NA3: QC flags and detection limits added by MK.4: Results QC'ed by KS."
,3859,1,4/20/2014,CALVERT,HAKAI,FGS,1,819 OUTLET,206,NUT4688,F,51.657375,-128.042222,,,,0,,0.45nm,13,,2014-04-20T18:27:34.000Z,2014-04-20T07:00:00.000Z,2014-07-24T07:00:00.000Z,,10.2,,,,16.1,36.2,302.2,262.1,,,,3.4,6.4,18.7,14.2,5.4,AV,NA,AV,SVD,AV,AV,NA,NA,NA,AV,AV,SVD,AV,AV,NRAL,Results,Principal Investigator,,"1: Metadata has been QCd by BF2: NA3: QC flags and detection limits added by MK.4: Results QC'ed by KS."
,3860,1,4/20/2014,CALVERT,HAKAI,FGS,1,708 OUTLET,207,NUT4689,F,51.649199,-128.068516,,,,0,,0.45nm,13,,2014-04-20T19:40:30.000Z,2014-04-20T07:00:00.000Z,2014-07-24T07:00:00.000Z,,10.8,,,,15.6,15.7,233.3,190.2,,,,15.2,31.8,14.2,19.2,5.1,AV,NA,AV,AV,AV,AV,NA,NA,NA,SVC,AV,SVC,AV,AV,NRAL,Results,Principal Investigator,,"1: Metadata has been QCd by BF2: NA3: QC flags and detection limits added by MK.4: Results QC'ed by KS."
,3861,1,4/20/2014,CALVERT,HAKAI,FGS,1,693 OUTLET,208,NUT4690,F,51.647923,-127.996399,,,,0,,0.45nm,13,,2014-04-20T20:49:26.000Z,2014-04-20T07:00:00.000Z,2014-07-24T07:00:00.000Z,,11.7,,,,19.1,21.3,231.8,173.9,,,,5.1,9.8,2.3,13.9,6.6,AV,NA,AV,SVC,AV,AV,NA,NA,NA,SVD,AV,AV,AV,AV,NRAL,Results,Principal Investigator,,"1: Metadata has been QCd by BF2: NA3: QC flags and detection limits added by MK.4: Results QC'ed by KS."
